,index,Tweet,HS
431,431,ganjar ajak kades gali sejarah desa bagai pintu masuk tuju makmur madrid dewa 19 ukraina aku milik jejak sih gundul alan walker besok senin pendekar tamsis bakri yoyakarta andara ios 17 nasi goreng siwon polish chiesa kroos and modric tulus,NON_HATE
432,432,ganjar kader partai demokrasi indonesia juang ya tolol saja kalau sama kader tidak saling dukung,HATE
433,433,operasi ubah persepsi sedang laku olah pak jokowi pindah haluan dukung prabowo utama di media mainstream dan mulai gerak di darat juga yoyakarta besok senin andara aku milik bakri besok senin ukraina madrid,NON_HATE
434,434,saya terus terang ragu sama ganjar semenjak isu israel dan nyata ini,NON_HATE
435,435,bodoh amat mau anis ganjar prabowo bodoh amat lah kalian para pengikut2x calon presiden sontoloyo,HATE
436,436,menang ganjar bera i memenangkn indonesia dari golongan2 munafik,HATE
437,437,terima kasih lah kepada anies baswedan yang sudah susah payah hasil bawa ajang formula e ke indonesia lihat kan calon presiden mana yang prestasi anies hasil bawa formula e ke aindonesia dan ganjar hasil batal piala dunia u20 di indonesia,NON_HATE
438,438,ganjar pranowo yees,HATE
439,439,pernah saya dengar di acara televisi ganjar bialng jawa tengah sudah tidak ada jalan lubang lah nyata begini ganjar bohong atau bagaimana,NON_HATE
440,440,sabbe satta bhavantu sukhitatta,NON_HATE
441,441,moga semangat saling bagi bahagia terus bara di hati kita mari sama sama doa agar semua makhluk hidup rasa damai dan bahagia yang abadi,NON_HATE
442,442,selamat hari raya waisak 2567 be satu lilin dapat rang yang lain tanpa hilang sinar sepe i hal bahagia makin banyak kita bagi makin be ambah tanpa henti,NON_HATE
443,443,ucup dungdung pret anu mas anu kalau garuda yang di post yang mulia romo ganjar beda tidak hina itu walaupun dalam ada kolor yang bersliweran,HATE
444,444,ganjar akan ada lagi partai politik komunikasi dengan partai demokrasi indonesia juang,HATE
445,445,dapat lihat bahwa buah lapor kait jalan provinsi yang rusak langsung di respon dengan baik oleh bapak ganjar pranowo hal sebut dapat lihat bahwa aktivisme digital punya peran yang sangat baik bagi aktivitas di media sosial,NON_HATE
446,446,selamat nikmat gila ya bong karena harus pikir keras arah kakak bina buat jatuh anies haha gue tidak suka sih ganjar enjoy saja haha,HATE
447,447,jangan bahas anies lagi dong anies sudah tidak naik2 elektabilitasnya coba sekarang banding dengan istri ganjar dengan istri prabowo heeheehe,HATE
448,448,pak perintah kabupaten brebes itu kerja lamban dari dulu,NON_HATE
449,449,ulama dan santri dukung ganjar calon presiden 2024,NON_HATE
450,450,pak ganjar pranowo the best sudah,HATE
451,451,moga pak ganjar kalah,HATE
452,452,ulama dan santri dukung ganjar pada pilih presiden 2024,NON_HATE
453,453,calon presiden pilih baik kita untuk indonesia adalah pak pranowo,NON_HATE
454,454,buka topeng mu siapa yang sesuai nyata bukan citra ganjar pranowo tugas pak ai partai demokrasi indonesia juang anies baswedan tugas rakyat nasional demokrat,HATE
455,455,kumpul di senayan rawan jokowi deklarasi dukung ganjar di pilih presiden 2024,HATE
456,456,pale kamu fitnah itu nyata cuma kamu nya saja yang tidak mau aku bodoh ohya lupa anak buah cermin atasanya ya,NON_HATE
457,457,terima kasih telah hadir di hari ulang tahun ganjarist ke 2 kami rawan ganjarist siap all out menang mas ganjar,HATE
458,458,cirebon siap untuk pak ganjar calon presiden 2024,NON_HATE
459,459,ya ganjar tidak bisa cuma anis yang bisa terbit izin nya,HATE
460,460,pak ganjar pranowo calon presiden baik,HATE
461,461,serap aspirasi milenial rawan ganjar kenal sosok ganjar di bandung,NON_HATE
462,462,ganjar bicara tahan pangan publik tanya 10 tahun bapak jadi gubernur kok jawa tengah jadi provinsi miskin,NON_HATE
463,463,memang ada jabat bangun proyek pakai duit pribadi sih heru ganjar jokowi bangun jalan tol kreta cepat ikn ke ajati pakai duit pribadi mikirrr apalagi itu duit utang dan kamu masih sembah itu orang beda di mana beloon,NON_HATE
464,464,ganjar pranowo beri contoh proses kreatif kepada gen z dan milenial,NON_HATE
465,465,mari kita dukung pasang dari calon presiden 2024 kita pak ganjar pranowo dan wakil presiden pak prabowo subianto indonesia maju indonesia jaya,HATE
466,466,satu untuk ganjar pranowo,HATE
467,467,bagus nih cara pikir model surat pemberitahuan tahun istri pak ganjar ini biasa lahir dari turun orang orang yang cerdas dan didik jadi tidak banyak mau dalam jalan hidup,NON_HATE
468,468,ganjar tidak nge i apa yang sedang bicara,NON_HATE
469,469,omong doang tok bro ganjar bagaimana ikut kutoarjo kasus meteng ndisik,HATE
470,470,ganjar dan prabowo rebut pilih yang sama bila anies gagal calon a inya rugi besar buat partai demokrasi indonesia juang dan ganjar karena migrasi dukung ke prabowo kuat ganjar dan partai demokrasi indonesia juang dengan mudah akan habis lain cerita kalau anies lawan ganjar,HATE
471,471,kenapa kita mesti pilih pak ganjar pranowo di pilih presiden 2024 jadi begini,HATE
472,472,bacapres ganjar pranowo pagi tadi joging susur pecinan jaka a selain joging ganjar bdialog dengan tokoh agama juga laku di klenteng toa se bio yang bangun 1740 joging di tempat sejarah lain sepe i yoyakarta keren juga itu apalagi pakai cosplay pendekar biar tidak ada yang tawur,NON_HATE
473,473,deklarasi ganjar di lampung duga libat sekolah dan murid sekolah dasar riaunews,NON_HATE
474,474,buruh ganjar mau apa saja di mana saja bebas dan sah saja iya iya iya,NON_HATE
475,475,ganjar pranowo telah laku jumlah terobos dan toreh banyak prestasi calon pimpin yang selalu ada untuk rakyat,HATE
476,476,semangat pak kami ada untuk bapak ganjar,NON_HATE
477,477,survei baru prabowo kuat ganjar dan anies stagnan,HATE
478,478,sah rawan jokowi dukung ganjar pranowo jadi presiden 2024,HATE
479,479,moles jokowi lebih gampang karena belum calon presiden yang di pegang daerah khusus ibukota lah kalau ganjar sudah 2 periode pula mau ngeles juga susah,HATE
480,480,paling drama agar yang penting yang jadi salah satu dari prabowo atau ganjar tapi tetap bagi kursi di dewan wakil rakyat dan jabat lain lalu tetap lanjut roda oligarki untuk keruk kaya alam tanpa peduli risiko yang tanggung rakyat ah sudah biasa dengan tipu daya itu,NON_HATE
481,481,biar saja menang di awal kita lihat siapa yang akhir senyum ganjar,HATE
482,482,gila kamu ndro jadi kalau buzzernya anies fitnah ganjar dan jokowi boleh bebas begitu lagi coba anda sebut 1 contoh fitnah hadap anies karena apa yang sampai itu memang nyata ada tetapi kalian lah yang ban dan tipu masyrkat dengan hoaks,NON_HATE
483,483,buat semua untuk guna sosial media dukung ganjar mari wujud cita cita bangsa sama ganjar,HATE
484,484,sehat sehat pak ganjar cuma anda yang pantas jadi presiden ri bravo bravo pak ganjar,NON_HATE
485,485,terima kasih bang promotnya mantap betul rawan ganjar satu hati menang pak ganjar pranowo the next presiden for indonesia,NON_HATE
486,486,ganjar erick tohir hingga sandiaga terbang lampion di borobudur,HATE
487,487,sapa milenial jaka a ganjar beri contoh kerja kreatif lewat seni satu garis,NON_HATE
488,488,bisa nih fasilitas tim sukses anies lawan tim sukses ganjar hitung hitung untuk sadar rakyat yang didik rendah biar pilih presiden besok jangan salah pilih lagi,HATE
489,489,ganjar selalu dengar suara rakyat,NON_HATE
490,490,bravo pak ganjar untuk ri 2024,NON_HATE
491,491,kontol ganjar anjing kontol,NON_HATE
492,492,gila itu kamu tiap hari pikir anies bagaimana cara biar anies jatuh gue tidak suka sih ganjar biasa biasa saja slow,NON_HATE
493,493,bakal calon presiden bacapres 2024 dari partai demokrasi indonesia juang ganjar pranowo sempat sowan ke markas besar macan ali,HATE
494,494,ganjar kontol,NON_HATE
495,495,bocor nya anies di jegal lalu sama yang di menang moeldoko atau anies jadi sangka komisi berantas korupsi tinggal prabowo dan ganjar prabowo menang di tempat mungut suara namun kalah di komisi pemelihan umum gugat ke mk prabowo kalah dan jadi menteri lagi ganjar di lantik oleh jokowi jadi presiden,HATE
496,496,haha sih ganjar belum lengser tapi sudah berkampaye hitam hebat negeri cawe cawe,HATE
497,497,daerah istimewa yogyaka a,NON_HATE
498,498,alhamdulillah rawan jokowi sudah jelas labuh mana mari semua satu kuat untuk memenagkan pak ganjar ganjar for indonesia,HATE
499,0,lebur dengan semua elemen ganjar gas pool,NON_HATE
500,1,ganjar unggul di buzzerp,NON_HATE
501,2,nak aku pengene pak ganjar di pasangke pak prabowo pak ganjar calon presiden pak prabowo wacapres ken dapat oleh bedo seng penting podo sehat dan tidak boleh hujat,HATE
502,3,aku cah candisari semarang tidak dukung ganjar,NON_HATE
503,4,habib ali gus muhaimin sangat pas jadi calon wakil presiden ganjar prabowo atau anies baswedan,HATE
504,5,lagu pak haji ganjar pranowo sh mip gubernur baik se indonesia provinsi baik se indonesia calon presiden baik ter steril ter bersih di 2024 generasi terus baik di 2024,NON_HATE
505,6,sprinkle magic cupcake latih hias cupcake untuk millenial rabu 18 mei 2023 dpw srikandi ganjar jawa tengah garda perempuan milenial follow us instagram facebook srikandi ganjar jatengg,NON_HATE
506,7,ganjar sudah keluarga kok masih suka tonton begitu umum lagi jaga marwah keluarga saja dulu belum jaga marwah bangsa,HATE
507,8,parah ya ulah dukung ganjar indonesia mau tenggelam,HATE
508,9,jurkamnya ganjar angka survei gantung yang bayar oh oh,NON_HATE
509,10,saya 2014 amp 2019 dukung penuh pak prabowo tetapi hari ini kami akan dukung penuh pak anies mantan gubenurku daerah khusus ibukota jaka a pak prabowo di dorong oleh mereka hanya bagai pecah suara garis lurus saja biar pak ganjar lenggang dengan suara utuh,NON_HATE
510,11,anis najis ganjar menang,HATE
511,12,lihat apa yang diretweet anak ini ini sepe inya sudah kontrak jadi surveyor kubu ganjar kita lihat twit orang ini untuk waktu2 yad benar tidak analisa di atas ada twit dia yang jelek kena ganjar tidak butuh manusia ini ya,NON_HATE
512,13,tak pikir yang jago komunikasi itu om nyata om ganjar lebih jago dan lebih masuk ke dalam utama lebih rileks dan adaptif,NON_HATE
513,14,hubung megawati jokowi renggang begini reaksi ganjar,HATE
514,15,cbong ganjar mati gaya gue harus bilang woooi begitu,NON_HATE
515,16,viral giat rawan ganjar di lampung libat siswa sekolah dasar badan awas pilih umum turun tangan,HATE
516,17,duit ganjar dari mana ya kok tidak habis habis bagi bagi sembako usut dong komisi berantas korupsi,HATE
517,18,saya orang jawa tengah belum pernah lihat ada embung buat ganjar,NON_HATE
518,19,tribun yoyakarta ganjar tegas partai demokrasi indonesia juang makin solid,HATE
519,20,calon presiden ganjar wakil presiden nya erick,HATE
520,21,kalau ganjar jangan di tanya ijazah tetapi tanya uang e kartu tanda duduk mana,NON_HATE
521,22,nampak2nya sandi ke ppp dan usung jadi calon wakil presiden ganjar,NON_HATE
522,23,anies bukan yang baik tapi di antara trio macan prabowo ganjar anies anies masih yang baik,HATE
523,24,kalau ada selain ganjar yang orang jawa pasti menang,NON_HATE
524,25,lah mata po picek ono seng nama bupati memang tugas e harus pak ganjar semua konen mudun itu bupati ini nek ra bisa kerjo nek nyata kwe orang demak kono demo neng bupati ini goblok di pek dewe,HATE
525,26,di depan ganjar rawan jokowi deklarasi dukung untuk pilih presiden 2024,NON_HATE
526,27,calon presiden 2024 ulama dan santri dukung ganjar sowan ke ulama karismatik kh adib di pondok pesantren buntet cirebon ganjar sambut ribu santri,NON_HATE
527,28,rawan jokowi kumpul di senayan deklarasi dukung ganjar di pilih presiden 2024,HATE
528,29,serap aspirasi milenial rawan kenal sosok ganjar di bandung,NON_HATE
529,30,kalau lawan ahok di pilih presiden pasti menang anies bro masalah sekarang lawan ganjar dan prabowo,HATE
530,31,muka gila kamu kemarin psi deklarasi calon presiden ganjar belum partai demokrasi indonesia juang putus bagaimana tidak panjat sosial nama sekarang kaesang kasihan itu anak cuma jadi objek biar psi masuk berita,NON_HATE
531,32,malah mungkin harap ganjar jadi laki,NON_HATE
532,33,semua akan ganjar pada waktu,NON_HATE
533,34,ganjar milenial center kalimantan tengah semangat abdi bangun negeri,NON_HATE
534,35,banget nih aku aku genep tekok ping3 cobo mbok list apa programe ganjar min,NON_HATE
535,36,ganjar suka bokep minim prestasi walaupun sudah 2 periode beda sama pak anies,HATE
536,37,survei indikator politik elektabilitas prabowo 38 persen ganjar 34 2 persen dan anies 18 9 persen,HATE
537,38,prestasi pak anies formule e dulu yang caci maki sekarang puji puji sama dukung ganjar mulut mu bau mas bukti bahwa dukung ganjarist gerombol otak kerdil malu,HATE
538,39,orang pimpin harus tunjuk wajah asli bukan topeng video ganjar pranowo dapat belangkon khas cirebon bagai tanda terima bagai masyarakat cirebon,NON_HATE
539,40,ayo menang ganjar untuk maju bangsa,HATE
540,41,calon presiden partai demokrasi indonesia juang ganti ganjar mantap,HATE
541,42,tak mau aku nek gabung play station r1 gp r2 mau aku pokok e tak mau pilih ganjar,NON_HATE
542,43,halo pak ganjar selamat pagi sudah lari mana lagi pak apa masih di jaka a kayak betah sekali ya jogging di jakarta terus ngomong ngomong bapak cocok lah jadi gubernur daerah khusus ibukota kalau untuk ri 1 kayak belum sih pak orang rakyat tahun bapak cuma lari2 dan rawan sibuk bagi bagi sembako,NON_HATE
543,44,singkat kata sosial capital ini kuat partai demokrasi indonesia juang benar ganjar pranowo pernah singgung tentang sosial capital partai demokrasi indonesia juang,HATE
544,45,calon calon presiden partai demokrasi indonesia juang ganti ganjar mantap muda cerdas kreatif inovatif,HATE
545,46,dendam sama jokowi karena di pecat dan dendam sama ganjar karena kalah pilih gubernur jawa tengah lihat dari dua kasus itu nyata tingkat dendam anda sangat tinggi untung dia orang tidak ada apa apa,NON_HATE
546,47,teknik tarik kuas yang laku oleh ganjar pranowo tunjuk bahwa ia adalah orang yang gesit,NON_HATE
547,48,dari hobi had duta bokep itu prestasi ganjar,HATE
548,49,anies unggul mana mask 2 ganjar pranowo doang nanti ada yang amuk,HATE
549,50,miduk ganjar adalah kita ganjar saya senang tonton bokep miduk kita senang tonton bokep,HATE
550,51,ganjar sama ky jokowi spikingnya medhoogg,HATE
551,52,mugo2 hasil maksud pak ganjar amin,NON_HATE
552,53,ganjar siji ganjar semua,HATE
553,54,bila gagal yapres suara dukung ganjar ke prabowo enak saja anies gagal gye golput,HATE
554,55,hasil prestasi kerja pak anies yang dulu mereka caci sekarang gerombol ganjar jilat ludah sendiri hai amit amit,HATE
555,56,spil prestasi ganjar dong kayak selain marathon antar kota dan antar provinsi,NON_HATE
556,57,aku promo dan akan pilih ganjar tetapi aku psi bukan partai demokrasi indonesia juang,NON_HATE
557,58,jadi begini saat ini sudah pasuk mana rakyat dan warganet untuk cawe2 jaga jago masing masing dukung anies sila bela anies dukung ganjar sila bela ganjar dukung prabowo sila bela prabowo asal jangan presiden saja yang cawe2 terlalu risiko,HATE
558,59,eh bokep tiap hari kamu lintas di lini masa gue bicara anies mulu dengan tidak fair kamu kasih tau terus prestasi ganjar biar orang pilih ganjar gue orang jaka a dan tau betul era pimpin anies jadi makin kamu fitnah anies makin tidak suka gue lihat ganjar karena kamu,NON_HATE
559,60,atur tampilin gambar megawati lagi sodor ganjar oleh 9 naga dan para bohir2 liberalis dengan bawa duit gepok belah kanan belah kiri bawa pistol,NON_HATE
560,61,mau ganjar mau prabowo oke oke saja asal jangan main politik identitas coba saling hormat toh kalian tuju untuk indonesia lebih baik,HATE
561,62,ganjar sampai proses kreatif yang dapat cipta dari agam situasi yang ada,NON_HATE
562,63,mas ganjar kok pucet aga kurang hapy hmmm,HATE
563,64,momen minggu 4 juni 2023 pak ganjar pranowo laku olahraga joging pagi di kawasan pecinan glodok jaka a barat sempat untuk minum kopi di kopi es tak kie dan potong rambut di kok tang dan dialog dengan tokoh agama di klenteng toa se bio,NON_HATE
564,65,kalau memang pak ganjar pantas puji kenapa tidak,HATE
565,66,badan awas pilih umum tugas kami hanya awas supaya seluruh giat pak ganjar lancar,NON_HATE
566,67,ria presiden kepada ganjar saat lari pagi di cirebon andara jejak sigundul jungkook dewa 19 aku milik pagi ukraina boiyen deh gea jihyo madrid mark lee mil pendekar malam minggu nasi goreng snsd,NON_HATE
567,68,dukung ganjar pranowo jadi presiden 2024,NON_HATE
568,69,warga indonesia kalian semua yakin mau jadi orang sepe i ini bagai pimpin indonesia di 2024 maaf saya tidak mau ikut jadi goblok sepe i dia maka saya pilih ganjar pranowo bagai presiden indonesia 2024,HATE
569,70,badan awas pilih umum komisi pemelihan umum kerja tidur ada tim ganjar bagi bagi sembako kampanye di masjid dan keliling2 indonesia tidak ada reaksi dari badan awas pilih umum sedang kalau anies salat jumat badan awas pilih umum buru buru bangun dengan ancam akan lapor anies atur di ri harus adil negara ri bukan milik partai demokrasi indonesia juang saja,NON_HATE
570,71,ganjar pranowo beri gelar anggota hormat luar biasa oleh laskar agung macan ali cirebon,HATE
571,72,baliho ganjar,HATE
572,73,semua pasti ganjar di 2024 spesialis tifu,HATE
573,74,heiii kakek haram jadah junjung kamu sih ganjar urus itu wilayah banjir jalan beranta lobang banjir lemas amat bacot kamu tolol,HATE
574,75,memang sih ganjar tukang bagi amplop yang datang massa bayar semua,HATE
575,76,bukti cawe cawenya untuk pak ganjar,NON_HATE
576,77,saat lukman sosialisasi calon presiden ganjar pranowo di udanawu begini respon masyarakat,HATE
577,78,keren ganjar memang tepat jadi presiden toleran anies memang tepat jadi presiden indonesia tuju adil bagi seluruh rakyat indonesia,HATE
578,79,kapan akan tawar erick thohir bagai calon wakil presiden untuk damping ganjar atau prabowo dari pintu ke pintu ku coba tawar nama,NON_HATE
579,80,makin banyak yang dukung untuk menang ganjar pranowo jadi ri 1 menang total,NON_HATE
580,81,sepe i biasa hanya mampu bikin meme kalau pojok serang ganjar atau jokowi mantan gubernur bual selalu anggap hebat mata kadrun yang rabun tolak anis,NON_HATE
581,82,gempar postingan dukung ganjar ini rujak warganet gara gara sebut malu datang ke hajat formula e tanpa undang padahal ribu tonton datang pada beli tiket bukan karena undang,NON_HATE
582,83,yang tolak siapa enggak ada yang tolak kalian hanya baca media pro ganjar,HATE
583,84,anjing kamu iya om gue bilang mirip ganjar,NON_HATE
584,85,moga bapak ganjar pranowo jadi presiden india 2024,NON_HATE
585,86,rakyat ingin ubah den ganjar haha,HATE
586,87,kalem saja sih john panik amat orang prabowo juga belum deklarasi resmi jadi calon presiden pak ai usung koalisi nya juga belum final beda hal ganjar sama anies kamu lebih baik fokus berita ganjar yang bagus bagus sudah,NON_HATE
587,88,sebage ganti nanti tahun 2024 sian baskewan undang lantik pak ganjar jadi presiden ya gaeessss,HATE
588,89,parah dukung ganjar ini dukung dan yang dukung sama sama tukang tipu jaman jokohok itu harmoni bundar hi sampai depan istana banjir bandang jaman anis salur tata sistem tata hasil itu kawasan tidak pernah banjir,HATE
589,90,solid gerak kampanye untuk ganjar pranowo,HATE
590,91,jadi begini cokrotv itu banyak hanya buat analisa2 halu pak ai juga bisa buat kontra analisa dengan kata ganjar out dengan alas buzzerp yang sepe i denny siregar ini yang buat publik jadi ikut muak kepada ganjar kan simple benar iya tidak sih,NON_HATE
591,92,ingat saja pak ganjar dan pak prabowo itu masih jabat publik aktif dan sekarang calon presiden dari partai politik usung masing masing sementara pak anies sudah jadi rakyat biasa demokrasi kita harus lurus ini apakah orientasi pada lanjut kuasa atau layan publik,NON_HATE
592,93,ini kenapa kita harus pilih ganjar pranowo elegan dan tanpa bawa bawa isu sara jejak sih gundul dewa 19 tidur aku milik malam minggu alan walker besok senin yoyakarta solaria bakri nasi goreng 2023,NON_HATE
593,94,kalau konteks buat tahlil tidak semua orang islam tahlil kali,NON_HATE
594,95,dar awal memang dukung pak jokowi adalah dukung ganjar masa mau dukung aniiiiis,HATE
595,96,bera i lama ini pak jokowi belum benar kelola meritim kita padahal dulu kata ada tol laut nyata jujur juga anda mas ganjar bahwa jokowi belum benar benar kelola meritim kita,HATE
596,97,amin jokowi di hati ganjar di nanti ganjar pasti menang,HATE
597,98,dengan satu kita akan menang ganjar pranowo di pilih presiden 2024 datang jejak sih gundul dewa 19 tidur aku milik malam minggu alan walker besok senin yoyakarta solaria bakri nasi goreng 2023,NON_HATE
598,99,survei indikator politik prabowo unggul di tani dan buruh ganjar di pegawai negeri sipil,HATE
599,100,toleran buta ya tidak ingat sama wadas ingat ganjar ingat wadas,HATE
600,101,bukti bacot doang beda jauh banding anies yang cerdas konsep cerdas laksana kalau ganjar ngawur konsep ngawur laksana buzzernya ganas,HATE
601,102,jadi ingat wanita emas hasnaeni wanita emas sebut komisi pemelihan umum atur ganjar erick menang pilih presiden 2024,NON_HATE
602,103,saya sih lebih suka pimpin orang yang sehat jasmani dan rohani apalagi sikap orang yang keren pegang kendali atas emosi tidak ledak ledak kayak petas banting terang foto ganjar pranowo dan istri siti atikoh tidak sedang lari dari masalah,NON_HATE
603,104,kalau suruh pilih ganjar atau prabowo aku pilih prabowo kalau suruh pilih prabowo atau anies aku pilih anies ganjar tugas pak ai prabowo boneka jokowi anies tugas rakyat,HATE
604,105,deklarasi ganjar oleh anak anak sekolah dasar ya tidak apa2lah kalau deklarasi anies nah baru bisa anggap langgar iya tidak,HATE
605,106,banyak omong itu maaf saya tidak pilih ganjar pranowo dalam pilih presiden karena saya lihat beliau banyak citra,HATE
606,107,ganjar visioner coy,HATE
607,108,sedang jarang yang pilih pak karena beberapa kali pilih lihat di televisi saat dialog bambang pacul yang lalu kena tiap putus harus lapor bos juga beberapa kasus pak ganjar yang belum selesai,NON_HATE
608,109,ganjar memang buta mata dan hati berat aku tangan banjir jaka a oleh anies jauh lebih baik dari jokowi dan ahok apalagi banding dengan jawa tengah ganjar tidak ada apa apa 10 tahun ganjar cuma mbacot untuk tangan banjir jawa tengah,HATE
609,110,lihat 2 calon presiden proxy kadang dukung prabowo kadang dukung ganjar cawe cawe tidak jelas,HATE
610,111,bera i maksud jokowi tidak benar begitu wkwk jawa tengah saja tidak beres pak ganjar kok mau nyentil pak jokowi,HATE
611,112,fix tidak punya prestasi visi dan misi jual cuma radikal radikul yang tidak dukung ganjar otomatis cap bagai radikal kalau ganjar jadi presiden oposisi langsung di cap bagai radikal jijik,HATE
612,113,pesan ganjar pranowo untuk rumah aspirasi,HATE
613,114,ramah sekali pak ganjar ini,NON_HATE
614,115,ganjar pranowo tunjuk bagaimana rukun umat agama di indonesia,NON_HATE
615,116,pak ganjar memang top,HATE
616,117,harus gelora news tidak bias dengan hanya serang perintah ganjar dan prabowo tapi jilat pantat sih bule yaman,HATE
617,118,rawan antusias sambut resmi rumah aspirasi ganjar pranowo,HATE
618,119,ganjar pranowo terus pak jokowi,HATE
619,120,harus sepe i pak ganjar dong ini foto tampak banjir rob di demak tapi alhamdulillah buzzerp nya pada senang semua dan puji bahwa banjir ini rupa karunia tuhan atas air yang limpah,NON_HATE
620,121,erickthohirnews ganjar erick thohir sandiaga uno hadir festival lampion waisak di borobudur bangkitbersamaet,HATE
621,122,ganjar bicara tahan pangan publik tanya 10 tahun bapak jadi gubernur kok jawa tengah provinsi miskin,NON_HATE
622,123,ada yang mejeng di basis ganjar pranowo pantas saja cuma sedikit ug ajak foto lebih cuek warga haha,HATE
623,124,kicep memang belum gilir bicara ganjar yang di omong omong kosong belaka basa basi enggak jelas apa apa apa apa eh ehe saja calon presiden kok begitu,HATE
624,125,ada yang coba coba mejeng di basis ganjar pranowo ya cuek lah haha tidak tau diri banget sih,HATE
625,126,pak ganjar jadi presiden 2024 semua anak anak muda akan makin banyak beri ruang untuk ekspres jejak sih gundul dewa 19 tidur aku milik malam minggu alan walker besok senin yoyakarta solaria bakri nasi goreng 2023,NON_HATE
626,127,dukung alir deras buat ganjar dari bagai kelompok dan komunikasi,NON_HATE
627,128,kalau ganjar dukung pak ai korupsi bansos e kartu tanda duduk korupsi kuota haji dan jual beli jabat di menteri agama ya,HATE
628,129,sih goblok ini jangan tunjuk bodoh kita di depan orang banyak pakai otak kalau mentwit haha memang yang kamu dukung pak ainya bersih siapa ganjar paling banyak pak ainya korupsi siapa lagi prabowo lah sama saja kemarin kena juga kader,HATE
629,130,ganjar pasti menang dan ganjar presiden 2024 amin jejak sih gundul dewa 19 tidur aku milik malam minggu alan walker besok senin yoyakarta solaria bakri nasi goreng 2023,NON_HATE
630,131,sudah saya pasti keluarga besar kami mulai dari kakeh nenek sampai anak cucu dan sepupu 3 generasi trah simbah kami tidak akan pilih anoes kami pilih ganjar pranowo bagai presiden ri 2024,NON_HATE
631,132,ikut duka atas tinggal ibu anda tetapi ganjar lantik bulan agustus 2013 di bulan apa anda urus badan selenggara jamin sosial ibu anda kalau pun saat anda urus badan selenggara jamin sosial itu ganjar sudah jadi gubernur tentu masih banyak soal birokrasi dari gubernur belum yang belum bisa sederhana,NON_HATE
632,133,semangat pagi salam minum kopi ganjar selalu di hati tidak akan pindah lain hati,NON_HATE
633,134,tidak ganjar tidak makan,NON_HATE
634,135,siapa yang ajak kamu kamu kan sama suka den ganjar tiktokers ya sudah minggir tetapi kalau mau waras ayo pilih pak anies,HATE
635,136,kerja 2priode baru sekarang di kejar nya mungkin eng di calon eng bakal di kerjain ganjar kamu masih jadi gubernur fokus dulu bgusin jawa tengah kalau eng kamu mundur saja biar eng ribet,HATE
636,137,ya kamu juga rakyat kamu rakyat bagi mana kalau mau waras ya gabung ke pak anies kalau mau di halu saja ya ke den ganjar begitu saja kok repot,HATE
637,138,menang 1 putar pak ganjar pranowo,HATE
