,index,Tweet,HS
1432,434,sakit hati balas dendam politik busuk tidak punya urat malu anies tak undang di formula e jaka a 2023 rocky kuasa masih dendam padahal dia inisiator,HATE
1433,435,terima kasih pak anies moga segera jadi presiden sikat habis para buzzerp yang rusak satu dan satu jaya negara satu republik indonesia,HATE
1434,436,eh jawa omong kamu medok jelas kamu jawa tidak pernah tinggal dan jadi warga daerah khusus ibukota maka kamu tidak kenal 5 tahun cukup buat jaka a jadi hebat memang anies selalu bilang dia layan rakyat apa kamu sapelo maka tinggal di daerah khusus ibukota baru kamu rasa tulus anies untuk rakyat cuma ruhut yang jahat,NON_HATE
1435,437,jabat nya enggak ada malu ya lupa siapa gagas ayo pak anies baswedan buat mereka sedikit pikir,NON_HATE
1436,438,itu lobang2 hasil mas cokowi sekarang tutup biar calon presiden lain tidak cebur haha kayak tidak ada sumber lain lagi untuk menjelek2an anies moga orang tidak sesal telah besar mu salam santuy,HATE
1437,439,anies lebih negara satu republik indonesia,HATE
1438,440,memang rezim belum ini ada jadi orang orang intoleran bunuh orang di indonesia lah itu para laku bom apa saya memang orang yang intoleran tapi hanya kepada mereka yang sikap intoleransi apalagi yang bawa bawa agama sementara anies dukung oleh orang orang surat pemberitahuan tahun itu,NON_HATE
1439,441,ciri ciri anak ayah hanya berani serang pak ai dukung anies tapi melempem sama partai demokrasi indonesia juang ganjar fenomena apakah ini ku tak tahu,HATE
1440,442,2024 anies presiden indonesia tak bendung tak te andingi republik indonesia 1,HATE
1441,443,fun factnya anies pilih,HATE
1442,444,kami sangat menge i yang maksud dengan slogan anies ubah walaupun dia tidak jelas ubah bagaimana maka kami tidak akan pilih anies karena kami tidak ingin sepe i jaka a,NON_HATE
1443,445,sekarang tinggal enak waktu pak anies juang laksana formula e omong sampah kamu keluar semua sekarang kamu nikmat dasar munafik,HATE
1444,446,anies sayang allah rakyat yang ber iman kuasa dengki sayang setan dan iblis,NON_HATE
1445,447,mbah said didu calon wakil presiden for anies,NON_HATE
1446,448,wajar mereka para buzzer takut tengah mati kalau anies jadi presiden lapak nafkah mereka bakal tutup pasu dari ngebuzzer jadi nol balik ke gembel lagi jadi sekarang ya mati an bagaimana cara mereka mempe ahankan posisi,NON_HATE
1447,449,anies jelas memang bodoh lama ini aku belum pernah dengar dapat dia yang masuk akal selalu nalar tidak umum,HATE
1448,450,siapa yang ajak kamu kamu kan sama suka den ganjar tiktokers ya sudah minggir tetapi kalau mau waras ayo pilih pak anies,HATE
1449,451,komisaris pelni buruk dalam sejarah di indonesia kamu koar koar bilang anies gubernur buruk dalam sejarah gilir ajak adu data untuk bukti benar ucap kamu kamu malah koar koar di media sosial ini di sini orang pada tau kualitas kamu,NON_HATE
1450,452,begitu kubu belah culas dan sadis segala cara tempuh untuk jegal anies baswedan agar tidak populer,HATE
1451,453,ya kamu juga rakyat kamu rakyat bagi mana kalau mau waras ya gabung ke pak anies kalau mau di halu saja ya ke den ganjar begitu saja kok repot,HATE
1452,454,gambar kuat orang mandataris rakyat yang lupa diri siapa dan apa wajib kepada negara rakyat sesuai janji sumpah saat lantik rasa frustasi berat hadap fenomena anies yang ketar dunia,NON_HATE
1453,455,oke anies kamu have my attention berani sekali angkat isu sumber air minum yang asai korporasi,NON_HATE
1454,456,orang sabar insya allah akan petik hasil kelak yang nyuekin anies akan ganti cuek,HATE
1455,457,segmentasi pilih anies masih sangat batas pilih dominasi oleh kalang yang marah dan benci perintah sementara di sisi lain tingkat percaya kepada perintah jokowi masih sangat tinggi,HATE
1456,458,yang aneh kenapa pihak non koalisi usung anies pada panik dengan elekt anies yang jeblok itu,HATE
1457,459,masya allah sehat sehat terus ya pak anies amp keluarga moga allah selalu lindung,HATE
1458,460,beban tertawa padahal pak susilo bambang yudhoyono nyata dukung penuh pak anies tar blunder lagi nih penduking genjer kalau masalah begini wkwk,NON_HATE
1459,461,bonger hoker selalu benar fe di jaka a anies klaim jis di jaka a anies klain jaklingko anies klaim pokok semua yang jadi di jaka a itu karya gubernur batavia jp coen mata bonger hoker anies tukang klaim,HATE
1460,462,bismillah bi idznillah bapak anies presiden 2024 amin,HATE
1461,463,anies iya,NON_HATE
1462,464,perhati burung garuda versi anies dan ganjar nyata beda,NON_HATE
1463,465,anies keren ya om luar biasa,NON_HATE
1464,466,kalau anies korupsi logika sudah lama di tangkap komisi berantas korupsi anies ini banyak musuh bukti sampai sekarang susah untuk temu bukti bahwa anies korupsi logika saja lah,HATE
1465,467,buzzer rupiah mau bicara dan narasi apa fakta dari luar negeri aku prestasi anies untuk tangan banjir daerah khusus ibukota,NON_HATE
1466,468,akhir anies pada waktu malu malu begitu meng aku,NON_HATE
1467,469,other platforms are sok kind to them it really speaks to how twitter is just an echo chamber of insults,NON_HATE
1468,470,kalau pak anies salah pasti sudah pakai baju orange,NON_HATE
1469,471,terima kasih pak anies baswedan sudah buat jaka a tidak kalah dengan negara eropa amp asia lain insyaallah,NON_HATE
1470,472,sejak anies pakai mayat di pilih kepala daerah daerah khusus ibukota 2017 semua jadi tidak sama,NON_HATE
1471,473,semangat ya den 6 tahun tanpa henti sama coro televisi membully anies tapi anies makin populer sungguh hidup tiada manfaat,NON_HATE
1472,474,jadi simalakama tetap saja anies yang dapat nama siapa yang selenggara fe beda dengan esemka,NON_HATE
1473,475,anjing gong gong anies tetap presiden,HATE
1474,476,badan awas pilih umum dan komisi pemelihan umum sepe inya sudah di setting untuk jegal anies,HATE
1475,477,memang anies ada rasa hormat ke gubernur belum,NON_HATE
1476,478,lihat video rawan anies,HATE
1477,479,takut panik kalah populer jadi saing tak sehat anti anies amp politik busuk benar salah anies apa ya seperti benci banget sama enzim wkwk,NON_HATE
1478,480,simak survei baru calon presiden 2024 prabowo lawan ganjar lawan anies,HATE
1479,481,saya heran kenapa tiap lawan anies pada takut jika anies pilih jadi presiden ri sampai sampai serang dari segala arah tapi tenang pak anies orang yang te indas bakal kabul doa bakal dapat simpati dan empati dari rakyat,NON_HATE
1480,482,orang awam tau anies gagas fe sampai bisa laksana di indonesia jaka a untuk 5 musim bukan gagas fe di seluruh dunia,NON_HATE
1481,483,sakit masyarakat jawa tengah ucap ganjar tahan pangan harus beterima kasih kepada pak anies waktu jabat gubjkt karena masyarakat jawa tengah yang miskin ngluruk cari makan di jaka a,NON_HATE
1482,484,sandi ambil panggung dari pentas anies,HATE
1483,485,memang kamu tidak tau berita anies jelek indonesia di luar negeri atau kamu tidak sama tau,HATE
1484,486,tren turun elektabilitas anies baswedan pada jumlah survei ini sebab kata amat,NON_HATE
1485,487,sejak formula e pe sama gelar sudah lihat niat tidak harga itu tetapi sirkuit itu akan selalu identik dengan anies,NON_HATE
1486,488,lah cerita bagaimana hendri satrio jokowi panik dan takut kalah lagi dari anies,HATE
1487,489,pak anies memang selalu yang balik,HATE
1488,490,pak jokowi presiden banyak fitnah dan caci maki dari oposisi gilir kalau anies presiden orang surat pemberitahuan tahun deny tidak bakal berani sadis banget anies dan dukung,HATE
1489,491,ya maklum lah bapak anies kan mantan menteri didik lama 2 tahun sedang bapak gp hanya gubernur tetapi sat set dalam karya nyata bukan rangkai kata kata,NON_HATE
1490,492,komisaris badan usaha milik negara yang bicara begitu mata nya picek amp tidak punya prestasi kerja yang baik untuk mempe ahankan jabat kecuali dengan cara serang anies terus terus,HATE
1491,493,anies memang jago ngeles cocok jadi juru bicara beranta jadi pimpin daerah boro boro presiden,HATE
1492,494,insya allah atas izin dan rida allah subhanahu wa taala pak anies baswedan jadi presiden ri tahun 2024 amin,NON_HATE
1493,495,keren anies baswedan bisa jadi orang lain jadi tenar,HATE
1494,496,terus lama jabat kemarin apa saja bijak pak anies soal ini sudah pernah jadi program atau masih cita cita saja bentuk,NON_HATE
1495,497,pak anies 5 tahun jadi gubernur banyak program yang janji tak laksana masuk baik kawasan kumuh pak heru jabat belum 1 tahun,NON_HATE
1496,498,in saya allah anies presiden,NON_HATE
1497,0,itu kan dukung saja bilang anies tak pernah ngapa2in,NON_HATE
1498,1,anies baswedan for presiden,NON_HATE
1499,2,memang yang paling mudah itu adalah ekor tapi ise dan gagas tetap milik p anies sehabat apapu itu ekor akan tetap jadi ekor lama,NON_HATE
1500,3,prabowo dan anies kompak cuma ingin adu program dan gagas karena mereka dua memang tidak ada kerja yang bisa di pamer rakyat lebih suka adu kerja nyata dan program nyata surat pemberitahuan tahun 10 tahun dengan pakde kalau cuma adu omong doang an apa lagi kayak oke ngocehnya abud waaah tidak lagi deehhh nehiiiiii,NON_HATE
1501,4,nah itu kamu paham ini kamu kok serang gue dan orang lain,NON_HATE
1502,5,habib ali gus muhaimin sangat pas jadi calon wakil presiden ganjar prabowo atau anies baswedan,HATE
1503,6,pak anies top sekarang ada orang yang tidak tau malu bangga formula e padahal dulu caci dibully halang halang bahkan mau di jegal sekarang mereka dengan tidak tau malu klaim hasil kerja pak anies cebong memang urat malu sudah putus,HATE
1504,7,bayang anies di 2024 ruwet ruwet kata kata,NON_HATE
1505,8,hanya gerbong kosong doang yang akan gabung contoh arus bawah ppp saja dukung pak anies amp tidak mungkin pilih gemar bokep,HATE
1506,9,untuk indonesia raya lebih baik saya yakin dengan pak anies baswedan bagai ri 1 hasil survei belum jamin bos,NON_HATE
1507,10,ngareeep anies ya apa sih yang bangga oke oke uang muka 0 naturalisasi stop reklamasi sumur resap parkir air aibon thiner pulpen lebih bayar lab covid jis ada tidak program yang 100 hasil bohong karena iman saja mau kasihan kalian,NON_HATE
1508,11,kalau buka produksi dalam negeri a inya anggur kurang dan anies akan nikmat hasil kerja jokowi jika saja dia jadi presiden maupun tidak jadi presiden,NON_HATE
1509,12,ikut pak anies,HATE
1510,13,anies baik,HATE
1511,14,saya 2014 amp 2019 dukung penuh pak prabowo tetapi hari ini kami akan dukung penuh pak anies mantan gubenurku daerah khusus ibukota jaka a pak prabowo di dorong oleh mereka hanya bagai pecah suara garis lurus saja biar pak ganjar lenggang dengan suara utuh,NON_HATE
1512,15,haalaahhh tiap detik kerja kamu cuma nyi2rin anies bagaimana pula itu baru bagi bagi sembako saja sudah ricuh bagaimana mau urus negara,NON_HATE
1513,16,banten yang mana mas bro kita orang banten tidak sudi pilih capress gemar film biru tidak amanah pimpin jawa tengah jogging2 luar daerah padahal status masih gubernur tetap pilih anies dong,NON_HATE
1514,17,betapa jahat anies baswedan tim sukses rawan dan dukung sendiri lupa begitu saja,HATE
1515,18,di semua survei yang bayar partai demokrasi indonesia juang anies kalah terus kata rakyat tidak akan pilih anies tapi partai demokrasi indonesia juang dan selalu usaha habis anies bera i fakta aselinya anies menang bukan,NON_HATE
1516,19,yang panik itu siapa selalu putar balik pakta semua buzerp serang pak anies itu bukti panik,HATE
1517,20,jika ingin tahu hasil survei yang benar tunggu tanggal main nya rakyat yang rindu ubah tahu siapa yang pantas dan layak jadi pimpin di negeri ini hanya yang buta tuli saja yang tidak paham dengan ada karena mereka lebih senang di kibul anies baswedan 2024 insyaallah,NON_HATE
1518,21,gue percaya benar akan menang lawan jahat saat nya habis gelap terbit terang habis jokowi terbit anies baswedan,HATE
1519,22,hoaks mana foto anies hihi,NON_HATE
1520,23,pak anies baswedan selalu ada hati rakyat yang hati baik dan otak waras,HATE
1521,24,yang jelas sumur resap pak anies telah hilang banjir di kompleks rumah gue yang selalu jadi bas tahun sementara kalau gue ke semarang tiap hujan pasti banjir bahkan telah hujan deras pun banyaj halaman instansi perintah di sana banjir genang,NON_HATE
1522,25,coba disurvey kredibel juara ya pak anies,NON_HATE
1523,26,speechless tega banget jegal anies yang hasil bawa puncak ri,NON_HATE
1524,27,formula e event yang hebat dan luar biasa pantaslan anies baswedan selayaknua dapat harga bagai presiden ri 2024,NON_HATE
1525,28,anies kan dak punya dukung dan selalu di posisix buncit tapi gencar sekali di serang sama buzer2 sodomi anies untuk 1 kali putar,NON_HATE
1526,29,memang dapat pengaruh orang mang tidak lah sudah bosan dukung prabowo pilih anies lah,HATE
1527,30,anies sungguh sungguh dukung jokowi di pilih presiden 2014 sekarang anies petik balas sungguh itu rakyat bersungguh2 dukung anies presiden 2024 masing masing akan balas oleh allah,HATE
1528,31,bagaimana dukung anies itu cerdas kalau narasi asal bunyi sepe i kentut,NON_HATE
1529,32,tepat sekali panitia nya akan hilang muka karena semua audien ke pak anies pak anies lebih di hormat,HATE
1530,33,memang nya apa yang laku rezim anies kepada orang sepe i kalau menang kok sampai tidak berani,HATE
1531,34,kualitas rezim bobrok waktu bangun formula e juga jegal jegal supaya gagal tapi makin jegal anies baswedan makin sinar dan rakyat sudah paham rapat baris pilih anies baswedan for presiden 2024,NON_HATE
1532,35,up dong mana nih kok malah ke menteri sosial sih yang kena buka anies,HATE
1533,36,anies tolak ikn kita tolak anies,NON_HATE
1534,37,sudah paham pak ali anda boleh beroandangan tapi pandang anda sudah zalim orang yang baca bagi pak ali sudah jelas pula kan semua yang bahu anies ajan hilang akal sehat dan nilai negara satu republik indonesia nya,NON_HATE
1535,38,kalau sih adik dengan modal ngemis2 jabat dan fitnah pak anies dia harap jadi komisaris terus,HATE
1536,39,luar biasa pak anies,NON_HATE
1537,40,he monyet kalau ada bukti kenapa sampai sekarang anies tidak di jadi sangka oleh komisi berantas korupsi toh anies sudah tidak gubernur lagi novel yang di fitnah lindung anies sudah tidak di komisi berantas korupsi lagi punya otak itu buat pikir makanya jangan banyak makan an tidak kamu,NON_HATE
1538,41,enggak perlu banyak kata berkat tangan dingin yang tulus anies orang yang masih ndesit hasil jadi presiden ruarr biasa,HATE
1539,42,pe amina enggan sponsor formula e era anies beda dengan tahun ini gigin demi cuan dan kuasa politik,NON_HATE
1540,43,nyata kerja pak anies di formula e untung daerah khusus ibukota sehingga buat serial,NON_HATE
1541,44,makin yakin inyong orang jawa tengah dukung mas anies,NON_HATE
1542,45,sumur resap yang buat anies apresiasi oleh badan tanggulang bencana daerah bpbd,NON_HATE
1543,46,refly ini bagi dari baris sakit hati karena buang dan jadi sakit sekarang beliau lihat ada sempat pada anies dan mulai menjilat2 pantat anies dengan indah agar beri jabat atau proyek,NON_HATE
1544,47,kamu mau bikin malu anies eh nyata malah kasih panggung,HATE
1545,48,kalau anies menang di rakyat,HATE
1546,49,tanpa kamu harap formula e sudah jadi ajang promosi jaka a sejak pak anies baswedan upaya dan resmi her,NON_HATE
1547,50,ikut saja tapi tetap kritis adik adik muda lihat rekam jejak pejabat2 psi ada yang tidak etika tidak ada yang merendah2kan orang dan ada yang pecah belah masyarakat tidak lihat giring yang menjelek2kan formula e dan cerita bagaimana anies hambat untuk bangun,NON_HATE
1548,51,jangan langsung percaya kalau anies melambai2kan tangan kepada khalayak dia manipulatif dengan rekayasa digital,NON_HATE
1549,52,buzzer jokowi buzzer anies ribut ribut soal agama wkwk banyak nyabu kalian jadi mabuk agama pantas saja kalian tidak kaya2 udhlah miskin masih sibuk urus agama orang fokus kerja saja biar tajir bro jadi tidak perhati twitter terus macam anggur,NON_HATE
1550,53,sama saja dul kalian yakin sih anies unggul tetapi tiap hari bacot jokowi terus yang sudah jelas tidak ikut tanding goblok mana,HATE
1551,54,anies bukan yang baik tapi di antara trio macan prabowo ganjar anies anies masih yang baik,HATE
1552,55,anies baswedan tipikal manusia ambisius yang tidak segan segan melalakukan apa dengan cara apa telah bukti di daerah khusus ibukota dengan cara lompat kodok injak dan tindas kepala siapa saja yang ada bawah dengan cara halus namun kejam untuk dapat syahwat dan ambisi nya,NON_HATE
1553,56,kalau lawan ahok di pilih presiden pasti menang anies bro masalah sekarang lawan ganjar dan prabowo,HATE
1554,57,ya murid dengan mudah jadi presiden masa bagai guru boleh dong anies naik anti murid yang hampir purnabakti selesai tugas guru mentor hebat pasti hasil murid yang hebat juga,NON_HATE
1555,58,sudah jelas rekam jejak ubah anies di jakarta yang mau lanjut ubah kata kata banyak istilah akan ubah kalau jadi presiden exc orang miskin jadi belumkaya korupsi distribusivitamin dan terus,NON_HATE
1556,59,cara cara jahat mereka laku untuk bungkam dan jegal anies hingga skrgpun tidak di undang tetapi itu semua justru lihat jahat mereka anies makin sinar,HATE
1557,60,yang harap anies gagal calon presiden kayak mereka yang takut kompetisi cara sehat amp takut laku ubah ke arah yang lebih baik qs ar rad ayat 11 sungguh allah tidak ubah ada sesuatu kaum sehingga mereka ubah ada yang ada pada diri mereka sendiri,NON_HATE
1558,61,kalau memang bukan kaleng2 kenapa juga masih fokus sama anies,NON_HATE
1559,62,anda nilai sesuatu yang jadi prinsip orang bahrawi karena anda pikir sekitar anies saja bahrawi hanya nyata sejarah eh anda bawa asa syukur mau di bagi sejarah yang keren anda punya paling bawa asa,NON_HATE
1560,63,tunggu pak heru gelar pe andingan level internasional di jis bagaimana pak heru sudah bukti gelar formula e di circuit ancol terima kasih pak heru sudah aku legacy gubernur belum soal tiket itu recelah pak anies bisa beli sendiri pimpin hebat spo if,NON_HATE
1561,64,buat apa anda tuduh anies main korban padahal anda sendiri aku kalau anies sangat potensial jadi presiden karena pilih rakyat,HATE
1562,65,terima kasih pak anies formula e nyata untung sehingga buat seri,NON_HATE
1563,66,tuju calon pimpin pak anies presiden,HATE
1564,67,padahal yang panik itu anjing anjing buzzer karena apa karena kalau anies tidak di jegal pe sama anak istri anjing anjing buzzer bisa lapar ke 2 anjing anjing buzzer bisa gembel lagi dan yang 3 anjing anjing buzzer bisa buru sepe i londo ireng dulu maka nya anjing buzzer gencar fitnah anies,HATE
1565,68,anies out,HATE
1566,69,hadir hanya untuk urus anies,NON_HATE
1567,70,ini orang tidak punya prestasi cuma bisa ngerecokin hasil kerja pak anies,HATE
1568,71,maaf goreng tetap tidak mampu dongkrak elektabilitas anies,NON_HATE
1569,72,beda konteks yang naik jet itu bagai bakal calon presiden yang tonton formula e itu ya warga biasa bukan bakal calon presiden lagi yang kayak itu nasional demokrat bukan pak anies,NON_HATE
1570,73,belum tentu main korban lah dari tacb pak anies yang nandatanganin hingga jadi fe indonesia ya wajar kalau sekadar tonton dari hasil jerih payah atau mungkin anda yang salah nilai orang soal cf bukti kalau benar benar sangkut jangan cuma isu jelang pilih umum,NON_HATE
1571,74,keren kan karya pak anies,NON_HATE
1572,75,yang semangat jegal anies maju pilih presiden moga hidup sengsara,HATE
1573,76,sia yang berani jegal anies baswedan calon presiden pilih rakyat ri maka rakyat serentak bangkit lawan dengan revolusi besar panjang sejarah kalau dengan mudah kami kumpul 7 juta umat muslim di monas apa susah laku lagi sp i ini,NON_HATE
1574,77,ganjar suka bokep minim prestasi walaupun sudah 2 periode beda sama pak anies,HATE
1575,78,survei indikator politik elektabilitas prabowo 38 persen ganjar 34 2 persen dan anies 18 9 persen,HATE
1576,79,gubernur yang rajin interaksi dengan konstituen utama saat konstituen kritik kerja perintah provinsi itu amp kalau kurang interaksi dengan konstituen apalagi yang kritik surat pemberitahuan tahun macet dan lain lain heran ada yang mau anies jadi presiden,NON_HATE
1577,80,strategi kalah anies baswedan presiden jokowi lagi main aman teknik pecah belah suara,HATE
1578,81,kamu kaley yang harus pikir dulu anies jadi gubernur daerah khusus ibukota dapat gudang prestasi kok di anggap enggak bisa urus bikin ajang formula e saja aspal di blok tapi anues tetap kerja krs dan pantang serah untuk maju jak a and akhir sukses tapi ya tetap saja kaum belah enggak bisa lihat,NON_HATE
1579,82,anies waktu jabat hubung daerah khusus ibukota ibarat bapak kayak raya tetapi tidak bisa suksesin anak anak cuma muazin udel anies,HATE
1580,83,tua bangka goblok benar kamu tau atur tidak sih kamu kadang lah memang anies itu siapa kok harus di istimewa,HATE
1581,84,haha anies yang baik dia kan nikmat apa yang sudah kerja oleh dahulu sila crk ke dinas sumber daya air daerah khusus ibukota infrastruktur kendali banjir apa yang bangun di masa pimpin arb,NON_HATE
1582,85,prestasi pak anies formule e dulu yang caci maki sekarang puji puji sama dukung ganjar mulut mu bau mas bukti bahwa dukung ganjarist gerombol otak kerdil malu,HATE
1583,86,kalau menang ya bu tapi anies kalau kalah bagaimana,NON_HATE
1584,87,anies ter the best chief competition officer formula e albe o longo balap formula e jaka a 2022 baik dalam sejarah balap,NON_HATE
1585,88,proud of kamu mr anies baswedan,NON_HATE
1586,89,sudah kamu cukup gari klub masa lalu itu saja kalau soal politik itu gue yakin otak tidak sampai dan nanti jangan lupa untuk pilih anies saja,HATE
1587,90,wawancara pak anies di australia bicara fakta mana yang jelek kasus covid hingga kucur dana covid yang korupsi kan hasil dari tidak transparan nya data covid apa kamu mau dukung sih penilep bansos sana kumpul saja kamu sama sih juliari,NON_HATE
1588,91,anies salah garden kebun jika itu untuk tanam baik bunga atau buah contoh kebun jeruk kebun bunga produktif sedang park taman mrujuk pada ekterior alam yang bisa isi tanam hias wahana brmain hewan baik alami atau buat contoh safari park prigen jawa timur tonton main,NON_HATE
1589,92,anies adalah bicara subisidi mobil listrik memang dia sadar tidak anggar formula e yang dia hambur bukan lebih baik uang itu hambur tambah armada mobil bus listrik buat trans jaka a,NON_HATE
1590,93,huruf besar cetak miring cetak tebal pasang kerlip2 sudah saat indonesia pimpin orang guru viral meme anies guru jadi presiden nasional demokrat sudah saat indonesia pimpin orang guru,NON_HATE
1591,94,dendam saking benci anies tak undang tonton formula e,HATE
1592,95,media abal abal pesan oposisi tidak pernah kritik nasional demokrat demokrat partai adil sejahtera hanya serang kubu perintah dan selalu mengada2 karena yang punya media ini sih jidat ireng asong khilafah jilat pantat anies,HATE
1593,96,buzerr tolol tidak ada senjata baru ya buat serang pak anies berita basi dibawa2 kon tol,HATE
1594,97,drama formula e anies baswedan akhir dunia,NON_HATE
1595,98,sudah tidak usah pilih susah amat hidup kamu nanti juga calon presiden pilih anies saja,HATE
1596,99,nah mulai deh pada buka borok padahal yang dukung anies itu notabene 2019 dukung prabowo,HATE
1597,100,viral meski tonton sendiri untuk hadir ajang formula e dua di jaka a dunia internasional aku ajang formula e adalah sejarah prestasi anies untuk jaka a tingkat dunia lambe waras emas tetap emas meski tonton di tribun sekalipun,NON_HATE
1598,101,1 karena kontrak sudah di tanda ya harus dilanjutka 2 bilang sukses anies lah jelas jelas sekarang panitia dan semua bukan under anies lagi bagaimana sih,NON_HATE
1599,102,anies adalah keren cebong pada takut benar sama anies anies bikin cebong gemetar siang malam anies pilih cebong auto kejang,HATE
1600,103,yakin itu anies jadi calon presiden di 2024 3 pak ai nasional demokrat demokrat partai adil sejahtera sampai hari ini saja belum satu suara satu saja tidak satu suara alamat anies jegal pak ainya sendiri,NON_HATE
1601,104,anies dan segenap warga daerah khusus ibukota bisa bikin sirkuit formula e bukan sekadar ada ajang formula e tanpa minta dana ke badan usaha milik negara anda bisa apa anies dan warga daerah khusus ibukota bisa tetap ngebangun sirkuit formula e meski fitnah dan recok buzzer,NON_HATE
1602,105,ya karena rakyat indonesia makin pintar jadi imbas dukung anies makin sedikit karena hanya orang orang bodoh yang dukung anies,HATE
1603,106,daerah khusus ibukota jaka a adalah bukti bahwa ubah dengan tidak lanjut program gubernur belum malah tambah banjir tambah kumuh amp program sporadis parcial anies baswedan gagal total karena kurang minum kopi amp piknik,NON_HATE
1604,107,sadar juga kalau anies tidak kenapa apa mantap bro,HATE
1605,108,buzzerp memang harus musnah kalau nanti anies jadi ri 1,NON_HATE
1606,109,amaizing buat buat bang anies,NON_HATE
1607,110,anjing tidak punya malu hajat bang anies kamu nikmat dasar muka tembok kamu,HATE
1608,111,nasional demokrat seperti sesal dukung anies apa cuma tes ombak,HATE
1609,112,alahhh adalah mana berani sama anies,NON_HATE
1610,113,sudah kudegem moga anies agus harimurti yudhoyono good bye buat indonesia,HATE
1611,114,capitals of other countries are decorated dengan icons full of messages and meanings anies icons are full of immoral messages,NON_HATE
1612,115,media ini kerja hanya diskredit lawan politik anies dan jilat pantat anies,HATE
1613,116,pokok pak anies the best lah,NON_HATE
1614,117,anies dong,NON_HATE
1615,118,hmmm apakah anies juga pernah undang ahok ke suatu acara lama anies jabat bagai gubernur jaka a,NON_HATE
1616,119,sementara dukung pak anies dari pak ai pak ai yang ingin proporsional buka,NON_HATE
1617,120,anies unggul mana mask 2 ganjar pranowo doang nanti ada yang amuk,HATE
1618,121,benci anies itu buzzer locknut lgbt,HATE
1619,122,padahal anies tidak ada badan usaha milik negara yang sponsor ya,NON_HATE
1620,123,kasi ya para benci anies mau bikin formula e mesti minta dana ke badan usaha milik negara,HATE
1621,124,saya lebih tuju anies gatot nurmantyo biar balance dan lebih kuat wakil sipil militer rebut suara jawa tengah muda tua restrukturisasi militer bijak wibawa insyaallah indonesia bisa bangkit kembali amin,NON_HATE
