,index,Tweet,HS
871,372,berapa tahun amerika jadi negara besar berapa tahun jepang makmur berapa tahun cina kayak pak ganjar 10 tahun bangun jawa tengah bila belum makmur ya wajar yang penting bangun dijateng jadi dan makin baik ekonomi,NON_HATE
872,373,rawan jokowi deklarasi dukung ayah ganjar pranowo pada pilih presiden 2024,HATE
873,374,ganjar menang total merdeka moga juang ini di berkah dan di rida oleh allah subhanahu wa taala amin,HATE
874,375,momen ganjar dan erick thohir kompak terbang lampion waisak di borobudur,HATE
875,376,soal pilih pimpin gue rasional dan realistis saja jelas kelas anis jauh di atas ganjar no debat,NON_HATE
876,377,indonesia negara pak ganjar presiden ku mari sukses pilih umum demi indonesia yang lebih maju,HATE
877,378,lebih baik pak miduk usul prestasi pak ganjar ini pakai buat ajang internasional misal lomba renang begitu masa mau promosi karya pak,NON_HATE
878,379,den ganjar bagaimana toh,NON_HATE
879,380,ganjar pranowo,HATE
880,381,pak ganjar memang kader partai demokrasi indonesia juang sejak muda jadi cocok kader pak ai tugas pak ai,NON_HATE
881,382,tetap semangat pak ganjar jejak sih gundul dewa 19 ukraina aku milik alan walker siwon besok senin pendekar yoyakarta nasi goreng tamsis jungkook bakri sment stop mediaplay jihyo tulus,HATE
882,383,erickthohirnews kapan sanding dengan ganjar ini komentar erick thohir republika online mobile bangkitbersamaet,HATE
883,384,ganjar pranowo kembali sowan ke jumlah ulama kali ini dalam kunjung ke cirebon jejak sih gundul dewa 19 ukraina aku milik alan walker siwon besok senin pendekar yoyakarta nasi goreng tamsis jungkook bakri sment stop mediaplay jihyo tulus,HATE
884,385,pak ganjar mudah banget dekat sama masyar akat dari yang tua sampai anak muda,NON_HATE
885,386,baik pak ganjar,HATE
886,387,prestasi ganjar photo2 doang,HATE
887,388,ganjar aku pada,NON_HATE
888,389,ganjar dapat wejang soal bangsa siwon our eternal star jungkook aku milik andara jejak sih gundul yoyakarta alan walker benzema pledis tamsis besok senin forever dengan namjoon jihyo kim mingyu jiminie taeyeon nayeon 10 years dengan suga dewa 19 nct dream is coming jeon wonwoo,NON_HATE
889,390,rawan jokowi deklarasi dukung kepada ganjar siwon our eternal star jungkook aku milik andara jejak sih gundul yoyakarta alan walker benzema pledis tamsis besok senin forever dengan namjoon jihyo kim mingyu jiminie taeyeon nayeon 10 years dengan suga dewa 19 nct dream is coming,NON_HATE
890,391,hidup pak ganjar,HATE
891,392,yang tolol memang buzzer hidup ganjar okep,HATE
892,393,di provinsi jawa timur elektabilitas prabowo tinggal ganjar,NON_HATE
893,394,menang ganjar body mass index jaka a siap rebut hati anak muda ibu kota,NON_HATE
894,395,coba cek ini di tokopedia deh harga rp25 000,NON_HATE
895,396,viral deklarasi ganjar libat ajar sekolah dasar lampung selatan,NON_HATE
896,397,tiap ada acara pak ganjar pasti tinggal moga makin banyak acara kayak begini pak dan saya bisa ikut dan sehat selalu keluarga,NON_HATE
897,398,ganjar ajak kades gali sejarah desa bagai pintu masuk tuju makmur jejak sih gundul jungkook aku milik ukraina dewa 19 alan walker jjk1 is coming besok senin siwon nasi goreng malam minggu bakri pendekar sment stop mediaplay yoyakarta mark lee,NON_HATE
898,399,aku pilih ganjar sih kalau anies aku tidak suka dia bukan orang indonesia asli aku tidak mau,NON_HATE
899,400,pesan ganjar kepada seluruh rawan dan partai politik tanpa ada hoaks sara dan tanpa pecah belah,NON_HATE
900,401,banyak duit bro ganjar bisa bagi bagi sembako lumayan untuk masyarakat kecil harga harga sekarang kan pada naik by the way badan awas pilih umum boleh cara begini,NON_HATE
901,402,makin yakin siapa calon presiden baik tidak usah tanya pasti pak ganjar dong,NON_HATE
902,403,sepe inya pak ganjar biasa saja itu konten atau jenis ketimbang yang satu naik jet kawal layak pasu aman presiden jalan keluar masuk kampung ramai orang sampai keprosok selokan dan bagai sepe inya sepe i kebelet pipis yang tahan sampai basah si knya,NON_HATE
903,404,suka banyak kalang itu ganjar pranowo,HATE
904,405,lagi motor terus kejegat lampu merah tidak sengaja lihat baliho gede plus ada foto orang kira teh jose mourinho eh malah ganjar pranowo,HATE
905,406,deklarasi yang laksana oleh anak muda untuk dukung ganjar,NON_HATE
906,407,turut jokowi akan lebih dukung prabowo bagai terus karena sudah 5 tahun kerja bareng jokowi juga kecewa sama ganjar gara gara piala dunia u20 tidak jadi tapi jokowi tidak bisa apa apa harus ikut sama megawati,HATE
907,408,ganjar apa prabowo sama,HATE
908,409,terbang lampion waisak di borobudur ini doa ganjar erick thohir,HATE
909,410,ai lop yu pak ganjar only,NON_HATE
910,411,tanpa jual nama besar dan rawan pak ganjar bisa apa cari lah pimpin yang bisa bawa negeri ini maju dengan kualitas kerja nya kalau tidak punya mampu tidak usah paksa jadi bacapres apa tanpa embel embel nama besar jokowi tidak bisa apa ya maju sendiri,NON_HATE
911,412,aku juga ingin tahu rekam jejak yang baik untuk bangsa dari partai demokrasi indonesia p mega jokowi dan ganjar coba urai,HATE
912,413,tidak bisa tidor abg jadi sudah mau tepejam tadi lintas pula wak ganjar,HATE
913,414,tokoh politik yang bisa dekat dengan anak muda pak ganjar salah satu dengan dekat ini moga anak muda lebih peran dalam maju bangsa sukses selalu pak ganjar,NON_HATE
914,415,rupa kamu memang bego harus kamu sudah paham oke gue jelas dasar 1 etika ganjar itu laku knjungan2 saat dia masih jabat gubernur lepas hari lbr orang tidak kamu yang bicara badan awas pilih umum tidak negor karena tidak ada dasar dasar ke 2 adil satu tegur yang lqin harus juga tegur nge i kamu,HATE
915,416,survei indikator prabowo menang lawan ganjar dan anies di kalang milenial,HATE
916,417,tambang pasir rapi mungkin program pak ganjar untuk dukung program bangun infrastruktur ala pak jokowi fakta tambang pasir bukan manual mulai masif sejak naik pak jokowi jadi presiden periode 1 dan pak ganjar bagai gubernur jawa tengah,NON_HATE
917,418,elite kapan harus tegas jika tidak mau hilang suara kader dan akar rumput yang jelas suara buat ganjar jangan di harepin deh,HATE
918,419,rambut boleh putih tapi suara mantap betul silaturahmi pak ganjar dengan gen z amp millennial influencers selebriti instagram tiktokers di jaka a,NON_HATE
919,420,agus harimurti yudhoyono mantap anis pintar prabowo tegas ganjar presiden semua aset bangsa,HATE
920,421,ganjar pranowo hadir festival lepas lampion ingat hari suci waisak 2023 di candi borobudur ganjar pranowo gubernur jawa tengah hadir dengan penuh gembira festival lepas lampion ingat hari suci waisak 2023 yang ada di candi borobudur dalam momen yang sarat makna ini ganjar pranowo turut sambut hari suci waisak dengan penuh bangga dan rasa hormat,NON_HATE
921,422,bukan garis itu nama salah satu rawan ganjar,NON_HATE
922,423,kayak mana mau tidor den ganjar asyik bahas radikal radikul saja,HATE
923,424,menang total,NON_HATE
924,425,makanya usut kalau jadi napi kan ganjar tak ada saing lagi biar rakyat paham,HATE
925,426,percaya ibu mega hadap ganjar jejak sigundul aku milik andara alan walker besok senin dewa 19 ukraina madrid tamsis nasi goreng siwon jungkook yoyakarta pendekar hapsun bakri,HATE
926,427,gelegar gembira lang menang ganjar thema hari jadi ke 2 ganjarist dan makin gayeng dengan hadir jawara calon presiden partai demokrasi indonesia juang sebut pendekar yoyakarta jejak sih gundul,HATE
927,428,sowan pondok pesantren buntet cirebon ganjar dapat banyak wejang soal bangsa madrid dewa 19 ukraina aku milik jejak sih gundul alan walker besok senin pendekar tamsis bakri yoyakarta andara ios 17 nasi goreng siwon polish chiesa kroos and modric tulus,NON_HATE
928,429,luar biasa ribu rawan jokowi deklarasi dukung kepada ganjar pranowo madrid dewa 19 ukraina aku milik jejak sih gundul alan walker besok senin pendekar tamsis bakri yoyakarta andara ios 17 nasi goreng siwon polish chiesa kroos and modric tulus,NON_HATE
929,430,momen ganjar riak presiden saat lari pagi di cirebon madrid dewa 19 ukraina aku milik jejak sih gundul alan walker besok senin pendekar tamsis bakri yoyakarta andara ios 17 nasi goreng siwon polish chiesa kroos and modric tulus,NON_HATE
930,431,ganjar ajak kades gali sejarah desa bagai pintu masuk tuju makmur madrid dewa 19 ukraina aku milik jejak sih gundul alan walker besok senin pendekar tamsis bakri yoyakarta andara ios 17 nasi goreng siwon polish chiesa kroos and modric tulus,NON_HATE
931,432,ganjar kader partai demokrasi indonesia juang ya tolol saja kalau sama kader tidak saling dukung,HATE
932,433,operasi ubah persepsi sedang laku olah pak jokowi pindah haluan dukung prabowo utama di media mainstream dan mulai gerak di darat juga yoyakarta besok senin andara aku milik bakri besok senin ukraina madrid,NON_HATE
933,434,saya terus terang ragu sama ganjar semenjak isu israel dan nyata ini,NON_HATE
934,435,bodoh amat mau anis ganjar prabowo bodoh amat lah kalian para pengikut2x calon presiden sontoloyo,HATE
935,436,menang ganjar bera i memenangkn indonesia dari golongan2 munafik,HATE
936,437,terima kasih lah kepada anies baswedan yang sudah susah payah hasil bawa ajang formula e ke indonesia lihat kan calon presiden mana yang prestasi anies hasil bawa formula e ke aindonesia dan ganjar hasil batal piala dunia u20 di indonesia,NON_HATE
937,438,ganjar pranowo yees,HATE
938,439,pernah saya dengar di acara televisi ganjar bialng jawa tengah sudah tidak ada jalan lubang lah nyata begini ganjar bohong atau bagaimana,NON_HATE
939,440,sabbe satta bhavantu sukhitatta,NON_HATE
940,441,moga semangat saling bagi bahagia terus bara di hati kita mari sama sama doa agar semua makhluk hidup rasa damai dan bahagia yang abadi,NON_HATE
941,442,selamat hari raya waisak 2567 be satu lilin dapat rang yang lain tanpa hilang sinar sepe i hal bahagia makin banyak kita bagi makin be ambah tanpa henti,NON_HATE
942,443,ucup dungdung pret anu mas anu kalau garuda yang di post yang mulia romo ganjar beda tidak hina itu walaupun dalam ada kolor yang bersliweran,HATE
943,444,ganjar akan ada lagi partai politik komunikasi dengan partai demokrasi indonesia juang,HATE
944,445,dapat lihat bahwa buah lapor kait jalan provinsi yang rusak langsung di respon dengan baik oleh bapak ganjar pranowo hal sebut dapat lihat bahwa aktivisme digital punya peran yang sangat baik bagi aktivitas di media sosial,NON_HATE
945,446,selamat nikmat gila ya bong karena harus pikir keras arah kakak bina buat jatuh anies haha gue tidak suka sih ganjar enjoy saja haha,HATE
946,447,jangan bahas anies lagi dong anies sudah tidak naik2 elektabilitasnya coba sekarang banding dengan istri ganjar dengan istri prabowo heeheehe,HATE
947,448,pak perintah kabupaten brebes itu kerja lamban dari dulu,NON_HATE
948,449,ulama dan santri dukung ganjar calon presiden 2024,NON_HATE
949,450,pak ganjar pranowo the best sudah,HATE
950,451,moga pak ganjar kalah,HATE
951,452,ulama dan santri dukung ganjar pada pilih presiden 2024,NON_HATE
952,453,calon presiden pilih baik kita untuk indonesia adalah pak pranowo,NON_HATE
953,454,buka topeng mu siapa yang sesuai nyata bukan citra ganjar pranowo tugas pak ai partai demokrasi indonesia juang anies baswedan tugas rakyat nasional demokrat,HATE
954,455,kumpul di senayan rawan jokowi deklarasi dukung ganjar di pilih presiden 2024,HATE
955,456,pale kamu fitnah itu nyata cuma kamu nya saja yang tidak mau aku bodoh ohya lupa anak buah cermin atasanya ya,NON_HATE
956,457,terima kasih telah hadir di hari ulang tahun ganjarist ke 2 kami rawan ganjarist siap all out menang mas ganjar,HATE
957,458,cirebon siap untuk pak ganjar calon presiden 2024,NON_HATE
958,459,ya ganjar tidak bisa cuma anis yang bisa terbit izin nya,HATE
959,460,pak ganjar pranowo calon presiden baik,HATE
960,461,serap aspirasi milenial rawan ganjar kenal sosok ganjar di bandung,NON_HATE
961,462,ganjar bicara tahan pangan publik tanya 10 tahun bapak jadi gubernur kok jawa tengah jadi provinsi miskin,NON_HATE
962,463,memang ada jabat bangun proyek pakai duit pribadi sih heru ganjar jokowi bangun jalan tol kreta cepat ikn ke ajati pakai duit pribadi mikirrr apalagi itu duit utang dan kamu masih sembah itu orang beda di mana beloon,NON_HATE
963,464,ganjar pranowo beri contoh proses kreatif kepada gen z dan milenial,NON_HATE
964,465,mari kita dukung pasang dari calon presiden 2024 kita pak ganjar pranowo dan wakil presiden pak prabowo subianto indonesia maju indonesia jaya,HATE
965,466,satu untuk ganjar pranowo,HATE
966,467,bagus nih cara pikir model surat pemberitahuan tahun istri pak ganjar ini biasa lahir dari turun orang orang yang cerdas dan didik jadi tidak banyak mau dalam jalan hidup,NON_HATE
967,468,ganjar tidak nge i apa yang sedang bicara,NON_HATE
968,469,omong doang tok bro ganjar bagaimana ikut kutoarjo kasus meteng ndisik,HATE
969,470,ganjar dan prabowo rebut pilih yang sama bila anies gagal calon a inya rugi besar buat partai demokrasi indonesia juang dan ganjar karena migrasi dukung ke prabowo kuat ganjar dan partai demokrasi indonesia juang dengan mudah akan habis lain cerita kalau anies lawan ganjar,HATE
970,471,kenapa kita mesti pilih pak ganjar pranowo di pilih presiden 2024 jadi begini,HATE
971,472,bacapres ganjar pranowo pagi tadi joging susur pecinan jaka a selain joging ganjar bdialog dengan tokoh agama juga laku di klenteng toa se bio yang bangun 1740 joging di tempat sejarah lain sepe i yoyakarta keren juga itu apalagi pakai cosplay pendekar biar tidak ada yang tawur,NON_HATE
972,473,deklarasi ganjar di lampung duga libat sekolah dan murid sekolah dasar riaunews,NON_HATE
973,474,buruh ganjar mau apa saja di mana saja bebas dan sah saja iya iya iya,NON_HATE
974,475,ganjar pranowo telah laku jumlah terobos dan toreh banyak prestasi calon pimpin yang selalu ada untuk rakyat,HATE
975,476,semangat pak kami ada untuk bapak ganjar,NON_HATE
976,477,survei baru prabowo kuat ganjar dan anies stagnan,HATE
977,478,sah rawan jokowi dukung ganjar pranowo jadi presiden 2024,HATE
978,479,moles jokowi lebih gampang karena belum calon presiden yang di pegang daerah khusus ibukota lah kalau ganjar sudah 2 periode pula mau ngeles juga susah,HATE
979,480,paling drama agar yang penting yang jadi salah satu dari prabowo atau ganjar tapi tetap bagi kursi di dewan wakil rakyat dan jabat lain lalu tetap lanjut roda oligarki untuk keruk kaya alam tanpa peduli risiko yang tanggung rakyat ah sudah biasa dengan tipu daya itu,NON_HATE
980,481,biar saja menang di awal kita lihat siapa yang akhir senyum ganjar,HATE
981,482,gila kamu ndro jadi kalau buzzernya anies fitnah ganjar dan jokowi boleh bebas begitu lagi coba anda sebut 1 contoh fitnah hadap anies karena apa yang sampai itu memang nyata ada tetapi kalian lah yang ban dan tipu masyrkat dengan hoaks,NON_HATE
982,483,buat semua untuk guna sosial media dukung ganjar mari wujud cita cita bangsa sama ganjar,HATE
983,484,sehat sehat pak ganjar cuma anda yang pantas jadi presiden ri bravo bravo pak ganjar,NON_HATE
984,485,terima kasih bang promotnya mantap betul rawan ganjar satu hati menang pak ganjar pranowo the next presiden for indonesia,NON_HATE
985,486,ganjar erick tohir hingga sandiaga terbang lampion di borobudur,HATE
986,487,sapa milenial jaka a ganjar beri contoh kerja kreatif lewat seni satu garis,NON_HATE
987,488,bisa nih fasilitas tim sukses anies lawan tim sukses ganjar hitung hitung untuk sadar rakyat yang didik rendah biar pilih presiden besok jangan salah pilih lagi,HATE
988,489,ganjar selalu dengar suara rakyat,NON_HATE
989,490,bravo pak ganjar untuk ri 2024,NON_HATE
990,491,kontol ganjar anjing kontol,NON_HATE
991,492,gila itu kamu tiap hari pikir anies bagaimana cara biar anies jatuh gue tidak suka sih ganjar biasa biasa saja slow,NON_HATE
992,493,bakal calon presiden bacapres 2024 dari partai demokrasi indonesia juang ganjar pranowo sempat sowan ke markas besar macan ali,HATE
993,494,ganjar kontol,NON_HATE
994,495,bocor nya anies di jegal lalu sama yang di menang moeldoko atau anies jadi sangka komisi berantas korupsi tinggal prabowo dan ganjar prabowo menang di tempat mungut suara namun kalah di komisi pemelihan umum gugat ke mk prabowo kalah dan jadi menteri lagi ganjar di lantik oleh jokowi jadi presiden,HATE
995,496,haha sih ganjar belum lengser tapi sudah berkampaye hitam hebat negeri cawe cawe,HATE
996,497,daerah istimewa yogyaka a,NON_HATE
997,498,alhamdulillah rawan jokowi sudah jelas labuh mana mari semua satu kuat untuk memenagkan pak ganjar ganjar for indonesia,HATE
998,0,gubernur jawa tengah ganjar pranowo kata raya tri suci waisak 2567 be 2023 jadi momentum penting untuk rekat hubung antarumat agama,NON_HATE
999,1,calon wakil presiden anies baswedan sudah tentu demokrat percaya sosok bisa kejut prabowo dan ganjar,HATE
1000,2,coba cek ini di tokopedia deh harga rp25 000,NON_HATE
1001,3,menang total,NON_HATE
1002,4,jum at berkah bagi di jalan palembang,NON_HATE
1003,5,ganjar beri hadiah pusaka kujang,NON_HATE
1004,6,tak sepe i hari hari biasa tampak banyak warga yang lari pagi layak helat car free day nyata ratus warga glodok sedang antusias sambut muncul bacapres 2024 dari partai demokrasi indonesia juang ganjar pranowo,HATE
1005,7,ayah ganjar pranowo presiden 2024,HATE
1006,8,agam yang ada di indonesia dapat jaga dengan saudara sejati dan gotong royong dengan kembang cinta kasih selamat ingat hari raya trisuci waisak 2023 2567 be sahabat ganjar,NON_HATE
1007,9,kawasan glodok jaka a barat ramai warga yang tampak lari pagi hari ini layak di helat car free day,NON_HATE
1008,10,hai milenials satu bangsa satu indonesia satu presiden ganjar pranowo 2024 ganjarmilenial center banten semangat abdi bangun negeri,HATE
1009,11,probolinggo goyang saat ratus masyarakat sama sahabat ganjar laksana senam pagi sama seluruh pese a dengan kompak ikut alun musik se a gera yang pandu oleh instruktur senam,NON_HATE
1010,12,indonesia kuat indonesia sehat untuk ganjar pranowo 2024 giat senam sehat sama ratus warga karawang penuh riah jangan lupa olahraga ya sahabat,NON_HATE
1011,13,bacapres dari partai demokrasi indonesia juang ganjar pranowo lanjut safari politik jelang pilih presiden 2024 kali ini ganjar hadir acara konsolidasi menang partai demokrasi indonesia juang se daerah khusus ibukota jaka a,NON_HATE
1012,14,datang ke ibu kota ganjar pranowo laksana silaturahmi dengan gen z amp milenial influencers selebriti instagram tiktokers,NON_HATE
1013,15,indah buah beda,NON_HATE
1014,16,probolinggo goyang saat ratus masyarakat sama sahabat ganjar laksana senam pagi sama yuk tetap jaga kompak untuk ganjar pranowo presiden indonesia 2024,HATE
1015,17,indonesia kuat indonesia sehat untuk ganjar pranowo 2024 ayo semangat terus untuk ganjar pranowo presiden 2024,HATE
1016,18,rawan jokowi satu dukung ganjar pranowo untuk pilih presiden 2024 datang,HATE
1017,19,ganjar hadir konsolidasi partai demokrasi indonesia juang yang langsung di cirebon jawa barat ganjar pun jelas mengapa alas partai demokrasi indonesia juang harus menang pada pilih presiden datang,NON_HATE
1018,20,wisata alam nepal van java memang mikat gubernur jawa tengah ganjar pranowo beberapa kali gowes di lokasi sebut dan beri 2 ton cat untuk kembang obyek wisata,NON_HATE
1019,21,semangat pagi semangat terus pak ganjar pranowo hari lari pagi di cirebon lah gengsss penasaran seru ini lah foto lengkap,NON_HATE
1020,22,lumajang semangat dukung ganjar pranowo pada 2024 kali ini ratus warga serbu bazar murah yang ada oleh sahabat ganjar,HATE
1021,23,calon presiden indonesia ganjar pranowo mantap langkah tuju pilih presiden 2024 dengan hadir pada konsolidasi partai demokrasi indonesia juang yang langsung di cirebon,NON_HATE
1022,24,untung warga cirebon bisa lari pagi bareng pak ganjar pranowo admin kan ingin ikut juga,NON_HATE
1023,25,calon presiden indonesia ganjar pranowo laksana lari pagi di cirebon ganjar pranowo lari sama masyarakat untuk jaga kondisi tubuh agar tetap bugar mantap nih pak ganjar sehat selalu,NON_HATE
1024,26,pak ganjar lagi lari pagi riak presiden ya itu cita cita kita ya sahabat,NON_HATE
1025,27,ganjar presiden indonesia gema saat sang calon presiden kunjung ke cirebon,NON_HATE
1026,28,pemuda selalu bawa paradigma baru dalam hidup maka perintah mesti laku sesuai karena no one left behind terima kasih ya teman teman,NON_HATE
1027,29,semangat yang tunjuk para tani sangat luar biasa pada giat yang langsung pada sabtu 3 juni 2023,NON_HATE
1028,30,ganjar keluar dari hotel sekitar pukul 05 30 waktu indonesia bagi barat sabtu 3 juni 2023 dia kemudian lari susur jalan di kota udang tani oleh beberapa teman,NON_HATE
1029,31,akhir pekan ini habis ganjar pranowo untuk laku giat di cirebon jawa barat sepe i biasa calon presiden koalisi partai demokrasi indonesia juang dan ppp ini awal giat dengan jogging,NON_HATE
1030,32,silaturahmi dan kerja sama pak ai politik,NON_HATE
1031,33,ganjar sambut riah ribu rawan dan kader,NON_HATE
1032,34,saat ganjar mulai luk orang grafologi choe miracle menganalisa teknik tulis atau coret tangan sang gubernur jawa tengah itu,NON_HATE
1033,35,bakal calon presiden bacapres dari partai demokrasi indonesia juang ganjar pranowo unjuk skill luk pada kaos saat hangout dengan jumlah influencer tiktoker dan gen z di cirebon jawa barat sabtu 3 6 2023,NON_HATE
1034,36,agam yang ada di indonesia dapat jaga dengan saudara sejati dan gotong royong dengan kembang cinta kasih selamat ingat hari raya trisuci waisak 2023 2567 be,NON_HATE
1035,37,banding 7 hasil survei calon presiden 2024 baru ada lembaga sebut ganjar unggul prabowo dan anies,HATE
1036,38,kawasan glodok jaka a barat ramai warga yang tampak lari pagi hari ini layak di helat car free day mereka antusias sambut hadir bakal calon presiden bacapres 2024 dari partai demokrasi indonesia juang ganjar pranowo di daerah sebut,NON_HATE
1037,39,ada suasana beda di kawasan glodok jaka a barat minggu 4 6 pagi tak sepe i hari hari biasa tampak banyak warga yang lari pagi layak helat car free day car free day,NON_HATE
1038,40,kawasan glodok jaka a barat yang pagi ini ramai layak car free day sebab sedang lari pagi di sana akhir beliau finishkan tepat di vihara gedung chandra naya yang letak di novotel dekat pasar petak sembilan,NON_HATE
1039,41,bakal calon presiden bacapres partai demokrasi indonesia juang ganjar pranowo aku titip pesan oleh ketua umum megawati soekarno putri dalam laku sowan dengan ppp tiap kunjung ke daerah l,NON_HATE
1040,42,datang ke ibu kota ganjar pranowo laksana silaturahmi dengan gen z amp milenial influencers selebriti instagram tiktokers pe emuan ganjar dan milenial ini langsung cair,NON_HATE
1041,43,warga probolinggo milik tekad kuat untuk dukung ganjar pranowo pada pilih presiden 2024,HATE
1042,44,ganjar terus bangun komunikasi dengan semua partai politik,NON_HATE
1043,45,makin banyak pak ai kian dukung ganjar,NON_HATE
1044,46,hanya ganjar pranowo yang cocok lanjut segala prestasi yang telah buat oleh jokowi ganjar adalah kader ideologis yang telah tunjuk oleh partai demokrasi indonesia juang dalam lanjut amanat rakyat,NON_HATE
1045,47,puji syukur hadirat tuhan yang maha kuasa hasil survei simulasi 3 calon presiden tempat pak raih 38 pak 34 2 pak 18 9,NON_HATE
1046,48,seluruh nusantara kampanye hidup sehat cara riang gembira kali ini ratus masyarakat probolinggo goyang senam pagi sama biar senang badan sehat hati senang nanti,NON_HATE
1047,49,ratus warga karawang senam sehat pada pagi di hari minggu ini indonesia kuat indonesia sehat untuk 2024 sudah jadi tekad sama,NON_HATE
1048,50,yuk semangat sahabat kita harus bangkit untuk ganjar 2024 sepe i giat yang langsung di karawang,HATE
1049,51,gen z amp milenial influencers selebriti instagram tiktokers bagi adalah yang sama juang aniwe pak nyata dekat banget lah dengan generasi milenial antara mereka malah bahas tren saat ini keren,NON_HATE
1050,52,pak ganjar dekat dengan generasi milenial fakta gengs bukan hanya sekadar opini,NON_HATE
1051,53,isran noor selaras dengan ganjar dan prabowo amat gubernur kalimantan timur tak dekat sama anies,NON_HATE
1052,54,partai demokrasi indonesia juang bongkar rencana kapan sodor nama erick bagai calon wakil presiden ganjar,HATE
1053,55,pada kunjung ke cirebon ganjar pranowo sowan ke diam kh adib yang rupa pimpin pondok pesantren buntet cirebon pe emuan dua tokoh sebut asa sangat hangat dan penuh keluarga,NON_HATE
1054,56,siapa nih yang suka stres tiba tiba entah karena kerja lingkung atau bahkan pe emanan nah sekarang admin ada tips bagus untuk kelola stres kalian,NON_HATE
1055,57,ungkap dekat partai demokrasi indonesia juang dan ppp ganjar bicara soal peristiwa kudatuli,HATE
1056,58,siapa nih yang suka stres tiba tiba entah karena kerja lingkung atau bahkan pe emanan nah sekarang admin ada tips bagus untuk kelola stres kalian bagaimana ya kelola mari kita baca yuk papar,NON_HATE
1057,59,saat megawati bakar semangat kader partai demokrasi indonesia juang jaka a ganjar harus menang,HATE
1058,60,calon presiden partai demokrasi indonesia juang ganjar pranowo hadir konsolidasi partai demokrasi indonesia juang daerah khusus ibukota jaka a,HATE
1059,61,bakal calon presiden bacapres partai demokrasi indonesia juang ganjar pranowo dapat sambut riah di acara konsolidasi partai demokrasi indonesia juang daerah khusus ibukota di gelora bung karno senayan,HATE
1060,62,pak ganjar dapat pusaka kujang,HATE
1061,63,menang ganjar di pilih presiden 2024,NON_HATE
1062,64,desak airlangga mundur ampg kepung markas beringin,HATE
1063,65,ganjar pranowo hadir pada konsolidasi partai demokrasi indonesia juang yang langsung di daerah khusus ibukota jaka a,NON_HATE
1064,66,bakal calon presiden bacapres partai demokrasi indonesia juang ganjar pranowo dapat sambut riah di acara konsolidasi partai demokrasi indonesia juang daerah khusus ibukota di gelora bung karno senayan ganjar sebut jaka a memang beda salam pancasila merdeka jaka a selalu beda,NON_HATE
1065,67,coba cek ini di tokopedia deh harga rp35 000,NON_HATE
