,index,Tweet,HS
0,0,lebur dengan semua elemen ganjar gas pool,NON_HATE
1,1,ganjar unggul di buzzerp,NON_HATE
2,2,nak aku pengene pak ganjar di pasangke pak prabowo pak ganjar calon presiden pak prabowo wacapres ken dapat oleh bedo seng penting podo sehat dan tidak boleh hujat,HATE
3,3,aku cah candisari semarang tidak dukung ganjar,NON_HATE
4,4,habib ali gus muhaimin sangat pas jadi calon wakil presiden ganjar prabowo atau anies baswedan,HATE
5,5,lagu pak haji ganjar pranowo sh mip gubernur baik se indonesia provinsi baik se indonesia calon presiden baik ter steril ter bersih di 2024 generasi terus baik di 2024,NON_HATE
6,6,sprinkle magic cupcake latih hias cupcake untuk millenial rabu 18 mei 2023 dpw srikandi ganjar jawa tengah garda perempuan milenial follow us instagram facebook srikandi ganjar jatengg,NON_HATE
7,7,ganjar sudah keluarga kok masih suka tonton begitu umum lagi jaga marwah keluarga saja dulu belum jaga marwah bangsa,HATE
8,8,parah ya ulah dukung ganjar indonesia mau tenggelam,HATE
9,9,jurkamnya ganjar angka survei gantung yang bayar oh oh,NON_HATE
10,10,saya 2014 amp 2019 dukung penuh pak prabowo tetapi hari ini kami akan dukung penuh pak anies mantan gubenurku daerah khusus ibukota jaka a pak prabowo di dorong oleh mereka hanya bagai pecah suara garis lurus saja biar pak ganjar lenggang dengan suara utuh,NON_HATE
11,11,anis najis ganjar menang,HATE
12,12,lihat apa yang diretweet anak ini ini sepe inya sudah kontrak jadi surveyor kubu ganjar kita lihat twit orang ini untuk waktu2 yad benar tidak analisa di atas ada twit dia yang jelek kena ganjar tidak butuh manusia ini ya,NON_HATE
13,13,tak pikir yang jago komunikasi itu om nyata om ganjar lebih jago dan lebih masuk ke dalam utama lebih rileks dan adaptif,NON_HATE
14,14,hubung megawati jokowi renggang begini reaksi ganjar,HATE
15,15,cbong ganjar mati gaya gue harus bilang woooi begitu,NON_HATE
16,16,viral giat rawan ganjar di lampung libat siswa sekolah dasar badan awas pilih umum turun tangan,HATE
17,17,duit ganjar dari mana ya kok tidak habis habis bagi bagi sembako usut dong komisi berantas korupsi,HATE
18,18,saya orang jawa tengah belum pernah lihat ada embung buat ganjar,NON_HATE
19,19,tribun yoyakarta ganjar tegas partai demokrasi indonesia juang makin solid,HATE
20,20,calon presiden ganjar wakil presiden nya erick,HATE
21,21,kalau ganjar jangan di tanya ijazah tetapi tanya uang e kartu tanda duduk mana,NON_HATE
22,22,nampak2nya sandi ke ppp dan usung jadi calon wakil presiden ganjar,NON_HATE
23,23,anies bukan yang baik tapi di antara trio macan prabowo ganjar anies anies masih yang baik,HATE
24,24,kalau ada selain ganjar yang orang jawa pasti menang,NON_HATE
25,25,lah mata po picek ono seng nama bupati memang tugas e harus pak ganjar semua konen mudun itu bupati ini nek ra bisa kerjo nek nyata kwe orang demak kono demo neng bupati ini goblok di pek dewe,HATE
26,26,di depan ganjar rawan jokowi deklarasi dukung untuk pilih presiden 2024,NON_HATE
27,27,calon presiden 2024 ulama dan santri dukung ganjar sowan ke ulama karismatik kh adib di pondok pesantren buntet cirebon ganjar sambut ribu santri,NON_HATE
28,28,rawan jokowi kumpul di senayan deklarasi dukung ganjar di pilih presiden 2024,HATE
29,29,serap aspirasi milenial rawan kenal sosok ganjar di bandung,NON_HATE
30,30,kalau lawan ahok di pilih presiden pasti menang anies bro masalah sekarang lawan ganjar dan prabowo,HATE
31,31,muka gila kamu kemarin psi deklarasi calon presiden ganjar belum partai demokrasi indonesia juang putus bagaimana tidak panjat sosial nama sekarang kaesang kasihan itu anak cuma jadi objek biar psi masuk berita,NON_HATE
32,32,malah mungkin harap ganjar jadi laki,NON_HATE
33,33,semua akan ganjar pada waktu,NON_HATE
34,34,ganjar milenial center kalimantan tengah semangat abdi bangun negeri,NON_HATE
35,35,banget nih aku aku genep tekok ping3 cobo mbok list apa programe ganjar min,NON_HATE
36,36,ganjar suka bokep minim prestasi walaupun sudah 2 periode beda sama pak anies,HATE
37,37,survei indikator politik elektabilitas prabowo 38 persen ganjar 34 2 persen dan anies 18 9 persen,HATE
38,38,prestasi pak anies formule e dulu yang caci maki sekarang puji puji sama dukung ganjar mulut mu bau mas bukti bahwa dukung ganjarist gerombol otak kerdil malu,HATE
39,39,orang pimpin harus tunjuk wajah asli bukan topeng video ganjar pranowo dapat belangkon khas cirebon bagai tanda terima bagai masyarakat cirebon,NON_HATE
40,40,ayo menang ganjar untuk maju bangsa,HATE
41,41,calon presiden partai demokrasi indonesia juang ganti ganjar mantap,HATE
42,42,tak mau aku nek gabung play station r1 gp r2 mau aku pokok e tak mau pilih ganjar,NON_HATE
43,43,halo pak ganjar selamat pagi sudah lari mana lagi pak apa masih di jaka a kayak betah sekali ya jogging di jakarta terus ngomong ngomong bapak cocok lah jadi gubernur daerah khusus ibukota kalau untuk ri 1 kayak belum sih pak orang rakyat tahun bapak cuma lari2 dan rawan sibuk bagi bagi sembako,NON_HATE
44,44,singkat kata sosial capital ini kuat partai demokrasi indonesia juang benar ganjar pranowo pernah singgung tentang sosial capital partai demokrasi indonesia juang,HATE
45,45,calon calon presiden partai demokrasi indonesia juang ganti ganjar mantap muda cerdas kreatif inovatif,HATE
46,46,dendam sama jokowi karena di pecat dan dendam sama ganjar karena kalah pilih gubernur jawa tengah lihat dari dua kasus itu nyata tingkat dendam anda sangat tinggi untung dia orang tidak ada apa apa,NON_HATE
47,47,teknik tarik kuas yang laku oleh ganjar pranowo tunjuk bahwa ia adalah orang yang gesit,NON_HATE
48,48,dari hobi had duta bokep itu prestasi ganjar,HATE
49,49,anies unggul mana mask 2 ganjar pranowo doang nanti ada yang amuk,HATE
50,50,miduk ganjar adalah kita ganjar saya senang tonton bokep miduk kita senang tonton bokep,HATE
51,51,ganjar sama ky jokowi spikingnya medhoogg,HATE
52,52,mugo2 hasil maksud pak ganjar amin,NON_HATE
53,53,ganjar siji ganjar semua,HATE
54,54,bila gagal yapres suara dukung ganjar ke prabowo enak saja anies gagal gye golput,HATE
55,55,hasil prestasi kerja pak anies yang dulu mereka caci sekarang gerombol ganjar jilat ludah sendiri hai amit amit,HATE
56,56,spil prestasi ganjar dong kayak selain marathon antar kota dan antar provinsi,NON_HATE
57,57,aku promo dan akan pilih ganjar tetapi aku psi bukan partai demokrasi indonesia juang,NON_HATE
58,58,jadi begini saat ini sudah pasuk mana rakyat dan warganet untuk cawe2 jaga jago masing masing dukung anies sila bela anies dukung ganjar sila bela ganjar dukung prabowo sila bela prabowo asal jangan presiden saja yang cawe2 terlalu risiko,HATE
59,59,eh bokep tiap hari kamu lintas di lini masa gue bicara anies mulu dengan tidak fair kamu kasih tau terus prestasi ganjar biar orang pilih ganjar gue orang jaka a dan tau betul era pimpin anies jadi makin kamu fitnah anies makin tidak suka gue lihat ganjar karena kamu,NON_HATE
60,60,atur tampilin gambar megawati lagi sodor ganjar oleh 9 naga dan para bohir2 liberalis dengan bawa duit gepok belah kanan belah kiri bawa pistol,NON_HATE
61,61,mau ganjar mau prabowo oke oke saja asal jangan main politik identitas coba saling hormat toh kalian tuju untuk indonesia lebih baik,HATE
62,62,ganjar sampai proses kreatif yang dapat cipta dari agam situasi yang ada,NON_HATE
63,63,mas ganjar kok pucet aga kurang hapy hmmm,HATE
64,64,momen minggu 4 juni 2023 pak ganjar pranowo laku olahraga joging pagi di kawasan pecinan glodok jaka a barat sempat untuk minum kopi di kopi es tak kie dan potong rambut di kok tang dan dialog dengan tokoh agama di klenteng toa se bio,NON_HATE
65,65,kalau memang pak ganjar pantas puji kenapa tidak,HATE
66,66,badan awas pilih umum tugas kami hanya awas supaya seluruh giat pak ganjar lancar,NON_HATE
67,67,ria presiden kepada ganjar saat lari pagi di cirebon andara jejak sigundul jungkook dewa 19 aku milik pagi ukraina boiyen deh gea jihyo madrid mark lee mil pendekar malam minggu nasi goreng snsd,NON_HATE
68,68,dukung ganjar pranowo jadi presiden 2024,NON_HATE
69,69,warga indonesia kalian semua yakin mau jadi orang sepe i ini bagai pimpin indonesia di 2024 maaf saya tidak mau ikut jadi goblok sepe i dia maka saya pilih ganjar pranowo bagai presiden indonesia 2024,HATE
70,70,badan awas pilih umum komisi pemelihan umum kerja tidur ada tim ganjar bagi bagi sembako kampanye di masjid dan keliling2 indonesia tidak ada reaksi dari badan awas pilih umum sedang kalau anies salat jumat badan awas pilih umum buru buru bangun dengan ancam akan lapor anies atur di ri harus adil negara ri bukan milik partai demokrasi indonesia juang saja,NON_HATE
71,71,ganjar pranowo beri gelar anggota hormat luar biasa oleh laskar agung macan ali cirebon,HATE
72,72,baliho ganjar,HATE
73,73,semua pasti ganjar di 2024 spesialis tifu,HATE
74,74,heiii kakek haram jadah junjung kamu sih ganjar urus itu wilayah banjir jalan beranta lobang banjir lemas amat bacot kamu tolol,HATE
75,75,memang sih ganjar tukang bagi amplop yang datang massa bayar semua,HATE
76,76,bukti cawe cawenya untuk pak ganjar,NON_HATE
77,77,saat lukman sosialisasi calon presiden ganjar pranowo di udanawu begini respon masyarakat,HATE
78,78,keren ganjar memang tepat jadi presiden toleran anies memang tepat jadi presiden indonesia tuju adil bagi seluruh rakyat indonesia,HATE
79,79,kapan akan tawar erick thohir bagai calon wakil presiden untuk damping ganjar atau prabowo dari pintu ke pintu ku coba tawar nama,NON_HATE
80,80,makin banyak yang dukung untuk menang ganjar pranowo jadi ri 1 menang total,NON_HATE
81,81,sepe i biasa hanya mampu bikin meme kalau pojok serang ganjar atau jokowi mantan gubernur bual selalu anggap hebat mata kadrun yang rabun tolak anis,NON_HATE
82,82,gempar postingan dukung ganjar ini rujak warganet gara gara sebut malu datang ke hajat formula e tanpa undang padahal ribu tonton datang pada beli tiket bukan karena undang,NON_HATE
83,83,yang tolak siapa enggak ada yang tolak kalian hanya baca media pro ganjar,HATE
84,84,anjing kamu iya om gue bilang mirip ganjar,NON_HATE
85,85,moga bapak ganjar pranowo jadi presiden india 2024,NON_HATE
86,86,rakyat ingin ubah den ganjar haha,HATE
87,87,kalem saja sih john panik amat orang prabowo juga belum deklarasi resmi jadi calon presiden pak ai usung koalisi nya juga belum final beda hal ganjar sama anies kamu lebih baik fokus berita ganjar yang bagus bagus sudah,NON_HATE
88,88,sebage ganti nanti tahun 2024 sian baskewan undang lantik pak ganjar jadi presiden ya gaeessss,HATE
89,89,parah dukung ganjar ini dukung dan yang dukung sama sama tukang tipu jaman jokohok itu harmoni bundar hi sampai depan istana banjir bandang jaman anis salur tata sistem tata hasil itu kawasan tidak pernah banjir,HATE
90,90,solid gerak kampanye untuk ganjar pranowo,HATE
91,91,jadi begini cokrotv itu banyak hanya buat analisa2 halu pak ai juga bisa buat kontra analisa dengan kata ganjar out dengan alas buzzerp yang sepe i denny siregar ini yang buat publik jadi ikut muak kepada ganjar kan simple benar iya tidak sih,NON_HATE
92,92,ingat saja pak ganjar dan pak prabowo itu masih jabat publik aktif dan sekarang calon presiden dari partai politik usung masing masing sementara pak anies sudah jadi rakyat biasa demokrasi kita harus lurus ini apakah orientasi pada lanjut kuasa atau layan publik,NON_HATE
93,93,ini kenapa kita harus pilih ganjar pranowo elegan dan tanpa bawa bawa isu sara jejak sih gundul dewa 19 tidur aku milik malam minggu alan walker besok senin yoyakarta solaria bakri nasi goreng 2023,NON_HATE
94,94,kalau konteks buat tahlil tidak semua orang islam tahlil kali,NON_HATE
95,95,dar awal memang dukung pak jokowi adalah dukung ganjar masa mau dukung aniiiiis,HATE
96,96,bera i lama ini pak jokowi belum benar kelola meritim kita padahal dulu kata ada tol laut nyata jujur juga anda mas ganjar bahwa jokowi belum benar benar kelola meritim kita,HATE
97,97,amin jokowi di hati ganjar di nanti ganjar pasti menang,HATE
98,98,dengan satu kita akan menang ganjar pranowo di pilih presiden 2024 datang jejak sih gundul dewa 19 tidur aku milik malam minggu alan walker besok senin yoyakarta solaria bakri nasi goreng 2023,NON_HATE
99,99,survei indikator politik prabowo unggul di tani dan buruh ganjar di pegawai negeri sipil,HATE
100,100,toleran buta ya tidak ingat sama wadas ingat ganjar ingat wadas,HATE
101,101,bukti bacot doang beda jauh banding anies yang cerdas konsep cerdas laksana kalau ganjar ngawur konsep ngawur laksana buzzernya ganas,HATE
102,102,jadi ingat wanita emas hasnaeni wanita emas sebut komisi pemelihan umum atur ganjar erick menang pilih presiden 2024,NON_HATE
103,103,saya sih lebih suka pimpin orang yang sehat jasmani dan rohani apalagi sikap orang yang keren pegang kendali atas emosi tidak ledak ledak kayak petas banting terang foto ganjar pranowo dan istri siti atikoh tidak sedang lari dari masalah,NON_HATE
104,104,kalau suruh pilih ganjar atau prabowo aku pilih prabowo kalau suruh pilih prabowo atau anies aku pilih anies ganjar tugas pak ai prabowo boneka jokowi anies tugas rakyat,HATE
105,105,deklarasi ganjar oleh anak anak sekolah dasar ya tidak apa2lah kalau deklarasi anies nah baru bisa anggap langgar iya tidak,HATE
106,106,banyak omong itu maaf saya tidak pilih ganjar pranowo dalam pilih presiden karena saya lihat beliau banyak citra,HATE
107,107,ganjar visioner coy,HATE
108,108,sedang jarang yang pilih pak karena beberapa kali pilih lihat di televisi saat dialog bambang pacul yang lalu kena tiap putus harus lapor bos juga beberapa kasus pak ganjar yang belum selesai,NON_HATE
109,109,ganjar memang buta mata dan hati berat aku tangan banjir jaka a oleh anies jauh lebih baik dari jokowi dan ahok apalagi banding dengan jawa tengah ganjar tidak ada apa apa 10 tahun ganjar cuma mbacot untuk tangan banjir jawa tengah,HATE
110,110,lihat 2 calon presiden proxy kadang dukung prabowo kadang dukung ganjar cawe cawe tidak jelas,HATE
111,111,bera i maksud jokowi tidak benar begitu wkwk jawa tengah saja tidak beres pak ganjar kok mau nyentil pak jokowi,HATE
112,112,fix tidak punya prestasi visi dan misi jual cuma radikal radikul yang tidak dukung ganjar otomatis cap bagai radikal kalau ganjar jadi presiden oposisi langsung di cap bagai radikal jijik,HATE
113,113,pesan ganjar pranowo untuk rumah aspirasi,HATE
114,114,ramah sekali pak ganjar ini,NON_HATE
115,115,ganjar pranowo tunjuk bagaimana rukun umat agama di indonesia,NON_HATE
116,116,pak ganjar memang top,HATE
117,117,harus gelora news tidak bias dengan hanya serang perintah ganjar dan prabowo tapi jilat pantat sih bule yaman,HATE
118,118,rawan antusias sambut resmi rumah aspirasi ganjar pranowo,HATE
119,119,ganjar pranowo terus pak jokowi,HATE
120,120,harus sepe i pak ganjar dong ini foto tampak banjir rob di demak tapi alhamdulillah buzzerp nya pada senang semua dan puji bahwa banjir ini rupa karunia tuhan atas air yang limpah,NON_HATE
121,121,erickthohirnews ganjar erick thohir sandiaga uno hadir festival lampion waisak di borobudur bangkitbersamaet,HATE
122,122,ganjar bicara tahan pangan publik tanya 10 tahun bapak jadi gubernur kok jawa tengah provinsi miskin,NON_HATE
123,123,ada yang mejeng di basis ganjar pranowo pantas saja cuma sedikit ug ajak foto lebih cuek warga haha,HATE
124,124,kicep memang belum gilir bicara ganjar yang di omong omong kosong belaka basa basi enggak jelas apa apa apa apa eh ehe saja calon presiden kok begitu,HATE
125,125,ada yang coba coba mejeng di basis ganjar pranowo ya cuek lah haha tidak tau diri banget sih,HATE
126,126,pak ganjar jadi presiden 2024 semua anak anak muda akan makin banyak beri ruang untuk ekspres jejak sih gundul dewa 19 tidur aku milik malam minggu alan walker besok senin yoyakarta solaria bakri nasi goreng 2023,NON_HATE
127,127,dukung alir deras buat ganjar dari bagai kelompok dan komunikasi,NON_HATE
128,128,kalau ganjar dukung pak ai korupsi bansos e kartu tanda duduk korupsi kuota haji dan jual beli jabat di menteri agama ya,HATE
129,129,sih goblok ini jangan tunjuk bodoh kita di depan orang banyak pakai otak kalau mentwit haha memang yang kamu dukung pak ainya bersih siapa ganjar paling banyak pak ainya korupsi siapa lagi prabowo lah sama saja kemarin kena juga kader,HATE
130,130,ganjar pasti menang dan ganjar presiden 2024 amin jejak sih gundul dewa 19 tidur aku milik malam minggu alan walker besok senin yoyakarta solaria bakri nasi goreng 2023,NON_HATE
131,131,sudah saya pasti keluarga besar kami mulai dari kakeh nenek sampai anak cucu dan sepupu 3 generasi trah simbah kami tidak akan pilih anoes kami pilih ganjar pranowo bagai presiden ri 2024,NON_HATE
132,132,ikut duka atas tinggal ibu anda tetapi ganjar lantik bulan agustus 2013 di bulan apa anda urus badan selenggara jamin sosial ibu anda kalau pun saat anda urus badan selenggara jamin sosial itu ganjar sudah jadi gubernur tentu masih banyak soal birokrasi dari gubernur belum yang belum bisa sederhana,NON_HATE
133,133,semangat pagi salam minum kopi ganjar selalu di hati tidak akan pindah lain hati,NON_HATE
134,134,tidak ganjar tidak makan,NON_HATE
135,135,siapa yang ajak kamu kamu kan sama suka den ganjar tiktokers ya sudah minggir tetapi kalau mau waras ayo pilih pak anies,HATE
136,136,kerja 2priode baru sekarang di kejar nya mungkin eng di calon eng bakal di kerjain ganjar kamu masih jadi gubernur fokus dulu bgusin jawa tengah kalau eng kamu mundur saja biar eng ribet,HATE
137,137,ya kamu juga rakyat kamu rakyat bagi mana kalau mau waras ya gabung ke pak anies kalau mau di halu saja ya ke den ganjar begitu saja kok repot,HATE
138,138,menang 1 putar pak ganjar pranowo,HATE
139,139,perhati burung garuda versi anies dan ganjar nyata beda,NON_HATE
140,140,bagaimana usaha ganjar buat suara di dunia internasional,NON_HATE
141,141,cok ganjar urus banjir semarang saja deh jawa tengah masih banjir cok,NON_HATE
142,142,halo jangan lupa jangan pilih ganjar,NON_HATE
143,143,simak survei baru calon presiden 2024 prabowo lawan ganjar lawan anies,HATE
144,144,sakit masyarakat jawa tengah ucap ganjar tahan pangan harus beterima kasih kepada pak anies waktu jabat gubjkt karena masyarakat jawa tengah yang miskin ngluruk cari makan di jaka a,NON_HATE
145,145,rawan jokowi deklarasi dukung kepada ganjar dewa 19 jejak sigundul andara ukraina tidur deh gea jihyo senin boiyen nasi goreng aku milik jjk1 is coming alan walker mil psht bakri mark lee,HATE
146,146,kenapa apa karena agama larang orang yang sering tonton video porno ganjar pranowo kan strategi menang pilih presiden 2024 tidak akan bawa isu agama,HATE
147,147,ya tapi dalam kembang karena yang di atas arogan sekarang grassrote punya diri sendiri kemarin umpama pilih puan bagai calon presiden mereka langsung pilih ganjar sendiri,HATE
148,148,kira kira kalau kita budidaya ganjar di pulau pribadi polisi tau tidak iya,HATE
149,149,tidak ingin hanya duduk manis ini potret sosok tarung sejati sepe i pak ganjar jejak sih gundul dewa 19 tidur aku milik malam minggu alan walker besok senin yoyakarta solaria bakri nasi goreng 2023,NON_HATE
150,150,cocok 100 analisa grafolog buat pak ganjar jejak sih gundul dewa 19 tidur aku milik malam minggu alan walker besok senin yoyakarta solaria bakri nasi goreng 2023,NON_HATE
151,151,ganjar di tempat bokep,NON_HATE
152,152,ganjar memang suka tonton bokep dia sendiri yang terang terang bilang di podcast deddy corbuziet jangan pilih ganjar yang suka bokep masa presiden indonesia hobi tonton bokrp malu,NON_HATE
153,153,hahahhaa jawa tengah provinsi yang tidak maju2 di era ganjar pranowo gagal total,HATE
154,154,gara sering ngikuti biasa ganjar sering tonton bokep tetangga gue sodomi dubur kambing,NON_HATE
155,155,ganjar pranowo sosok pimpin yang paling ideal ayo sama dukung ganjar untuk pimpin negeri ini,HATE
156,156,makin suka sama pak ganjar berangkat dari orang kurang mampu tau bagaimana hidup jadi orang susah,NON_HATE
157,157,upaya nyata ganjar bikin makin melarat rakyat hawa tengah,HATE
158,158,lihat bagaimana pak ganjar,NON_HATE
159,159,luar biasa rawan jokowi untuk ganjar,HATE
160,160,mantap pak moga the next presiden pak ganjar,NON_HATE
161,161,deklarasi ganjar untuk indonesia,NON_HATE
162,162,mantap rawan jokowi dukung ganjar untuk 2024,HATE
163,163,lihat banyak yang dukung pak ganjar,NON_HATE
164,164,dukung ke pak ganjar,HATE
165,165,presiden prabowo wakil ganjar untuk datang yaman boleh jadi menteri saja dulu,HATE
166,166,nah ini teman nya ganjar,NON_HATE
167,167,biasa di negeri ini kalau tidak viral tidak di gubris sesuai cara kerja ganjar yang kata kalau lihat jalan rusak di jawa tengah sila foto dan kirim ke twitter saya akan langsung di eksekusi sehingga jawa tengah jalan lubang hampir nol kata,NON_HATE
168,168,beware bisa ganjal lama masih ada ganjar,NON_HATE
169,169,strategi goblok yang bakal akhir fatal pe sama bantu jokowi agar bisa 2 kandidat saja otomatis suara ambil bagi dari jokower dong nah anies kan tidak ikut pasti all in ke prabowo tidak ada cerita bakal pilih tugas pak ai terus ganjar dapat apa,NON_HATE
170,170,mantap pak ganjar,HATE
171,171,lengkap derita samsak hidup antitesis p jokowi ganjar pranowo ganpro 2024,HATE
172,172,jual itu makmur rakyat pak ganjar jual kok intoleran radikal teroris memang rakyat bisa kenyamg,HATE
173,173,hibur melulu sudah ganjar jadi a is saja tidak usah jadi presiden biar presiden jadi tanggung jawab anies agar indonesia maju dan modern,NON_HATE
174,174,deklarasi menang ganjar,NON_HATE
175,175,pak ganjar rupa real life itachi rela dibully sekonoha agar israel tidak menang di tanah cinta,NON_HATE
176,176,ganjar di pulau sulawesi 10 suara,NON_HATE
177,177,kalau begini positif besar pasti menang nih pak ganjar,NON_HATE
178,178,dukung ganjar yang suka tonton bokep,HATE
179,179,rawan jokowi kumpul di senayan sat sikap dukung ganjar,HATE
180,180,gubernur jawa tengah ganjar pranowo kata raya tri suci waisak 2567 be 2023 jadi momentum penting untuk rekat hubung antarumat agama,NON_HATE
181,181,rawan jokowi dukung pak ganjar jadi presiden,HATE
182,182,gubernur jawa tengah ganjar pranowo kata raya tri suci waisak 2567 be 2023 jadi momentum penting untuk rekat hubung antarumat agama rangkai giat hari raya umat buddha di candi borobudur magelang jawa tengah itu jadi magnet sendiri yang undang masyarakat lintas agama suku dan golong untuk turut hadir,NON_HATE
183,183,mantap pak ganjar makin banyak yang usung,NON_HATE
184,184,pilih ganjar saja,HATE
185,185,dukung ini akan jadi semangat dan yakin bagi ganjar pranowo untuk hadap pilih presiden 2024 jejak sih gundul dewa 19 tidur aku milik malam minggu alan walker besok senin yoyakarta solaria bakri nasi goreng 2023,NON_HATE
186,186,waduh jangan main sara lihat saja rekan jejak kerja ganjar itu suka datang ke kiyai arab kamu,NON_HATE
187,187,jangan pilih ganjar yang suka bokep sama sekali tidak mutu,NON_HATE
188,188,mari sama sama kita dukung ganjar pranowo jadi presiden ri 2024 beliau adalah sosok yang tepat untuk pimpin bangsa indonesia,NON_HATE
189,189,mudah bandung dukung ganjar,NON_HATE
190,190,deklarasi nasionala ganjar,HATE
191,191,sosok ganjar,HATE
192,192,maju terus pak ganjar,NON_HATE
193,193,rekam jejak ganjar bagi sembako semarang demak banjir wadas tugas pak ai rekam jejak anies jis rumah susun aquarium formula e dan lain lain bukan tugas pak ai,NON_HATE
194,194,ganjar wakaf,HATE
195,195,makanya gue heran sama mereka ini mereka tiap hari cuma bahas saja bahkan tidak pernah di up prestasi ganjar,NON_HATE
196,196,baru hasil survei calon presiden 2024 anies terjun bebas prabowo dan ganjar roket cek simulasi h2h,HATE
197,197,ganjar tidak mutu bokep,HATE
198,198,denny indrayana jokowi ingin tarung ganjar pranowo dan tribun manado,HATE
199,199,ganjar juga bukti terima suap dana e kartu tanda duduk tunggu saja tanggal main akan ungkap semua,NON_HATE
200,200,bagai kader pak ai dan tugas pak ai dan semua orang calon presiden juga status harus sing kader dan tugas pak ai kenapa hanya ganjar yang di serang dengan diksi tugas pak ai toh sistem perintah kita harus begitu kalau mau bebas ya jangan lewat pak ai,NON_HATE
201,201,kemarin sudah nongkrong bareng gen z sekarang juga olahraga makin yakin nih sama pak ganjar,HATE
202,202,simak survei baru calon presiden 2024 prabowo subianto lawan ganjar lawan anies cnbc indonesia,HATE
203,203,prabowo subianto subianto tanya jadi calon wakil presiden untuk ganjar pranowo begini jawab suara cirebon,HATE
204,204,tak ada yang tidak mungkin kalau kita satu ganjar pranowo ri 1 2024 jejak sih gundul dewa 19 tidur aku milik malam minggu alan walker besok senin yoyakarta solaria bakri nasi goreng 2023,NON_HATE
205,205,pak ganjar piara burung gereja ya,NON_HATE
206,206,terus semangat kobar dukung kawan kawan kaum buruh kita kawal terus ganjar pranowo tuju ri 1 2024 jejak sih gundul dewa 19 tidur aku milik malam minggu alan walker besok senin yoyakarta solaria bakri 2023,NON_HATE
207,207,tetap dong pilih anies agar indonesia lebih maju modern dan adab daripada pilih ganjar suka bokep tanpa prestasi yang dukung pak ai dengan kasus korupsi banyak se indonesia,HATE
208,208,jangan munafik pak ganjar dosa hidup apa ada saja tidak mungkin gubernur makan sepe i itu sadar kampaye yang bagus jangan citra,HATE
209,209,jose mourinho kalau lihat lihat mirip ganjar pranowo,HATE
210,210,moga pilih jadi presiden pak ganjar,HATE
211,211,begitu juga jika prabowo gagal calon presiden sesuatu jadi pada maka prediksi saya suara prabowo dan ganjar semua ke anies titik,HATE
212,212,erickthohirnews kapan rapat ke partai demokrasi indonesia juang jika calon wakil presiden ganjar erick thohir politik rakyat merdeka on line bangkitbersamaet,HATE
213,213,calon wakil presiden anies baswedan sudah tentu demokrat percaya sosok bisa kejut prabowo dan ganjar,HATE
214,214,ganesa dpln hong kong dukung bulat ganjar pranowo rawan ganesa dpln hong kong deklarasi dukung kepada bacapres partai demokrasi indonesia juang ganjar pranowo bagai presiden ri tahun 2024,HATE
215,215,hasto sebut ada pak ai lain yang akan dukung ganjar,NON_HATE
